bangla_speech,combined,ipa_output
তারপর থেকেই মেয়ের আচরনে পরিবর্তন দেখা যায়,Mymensingh তারপর থাইক্কাই মাইয়ার আচরনে পরিবর্তন দেহা যায়,menʃɪng t̪ɐɾpɔɾ t̪ʰɐ͡ɪ̯kkɐ͡ɪ̯ mɐ͡ɪ̯ʲɐɾ ɐcɾɔne poɾɪbɔɾt̪on d̪ehɐ ɟɐe̯
আমার মা সব কাজ একা করছে,Mymensingh আমার মা বেগ কাম একলা করসে,mɔʲenʃɪn ɐmɐɾ mɐ beg kɐm ɛklɐ koɾʃe
মেয়ের মা একদিনও আমাদের বাড়ীতে আসে নাই,Mymensingh মাইয়ার মা একদিনও আমরার বাড়ীত আয় নাই,mɔʲenʃɔn mɐ͡ɪ̯ʲɐɾ mɐ ɛkd̪ɪno ɐmɾɐɾ bɐɽɪt̪o ɐe̯ nɐ͡ɪ̯
আমার আম্মুর সাথে ঝগড়া করে আমার ভাইয়ের বউ,Mymensingh আমার আম্মার লগে ঝগড়া কইরা আমার ভাইয়ের বউ,mɔʲensɪng ɐmɐɾ ɐmmɐɾ lɔge ɟʱɔgɽɐ ko͡ɪ̯ɾɐ ɐmɐɾ bʱɐ͡ɪ̯ʲeɾ bɔ͡u̯
এই দুনিয়াতে আম্মু আব্বু ভাই ছাড়া আমার কেও নাই,Mymensingh এই দুনিয়াতে আম্মা আব্বা ভাই ছাড়া আমার কেও নাই,mɪmɪnʃɐt̪e ɐmmɐ ɐbbɐ bʱɐ͡ɪ̯ cʰɐɽɐ ɐmɐɾ ke͡o̯ nɐ͡ɪ̯
এই মেয়ে রীতিমতো আমার ভাই আর মাকে কষ্ট দিচ্ছে,Mymensingh এই মাইয়া রীতিমতো আমার ভাই আর মারে কষ্ট দিতাসে,mɔʲensɪn e͡ɪ̯ mɐ͡ɪ̯ʲɐ ɾɪt̪ɪmɔt̪o ɐmɐɾ bʱɐ͡ɪ̯ ɐɾ mɐɾe koʃto d̪ɪt̪ɐʃe
আমার ভাই আম্মুকে ধরে শুধু কান্না করে,Mymensingh আমার ভাই আম্মারে ধইরা খালি কানদে ,mɔʲensɪn ɐmɐɾ bʱɐ͡ɪ̯ ɐmmɐɾe d̪ʱo͡ɪ̯ɾɐ kʰɐlɪ kɐnd̪e 
মা কেন আমি এই জাগায় গেলাম,Mymensingh আম্মা কেন আমি এই জাগায় গেলাম,mɔʲensɪn ɐmmɐ keno ɐmɪ e͡ɪ̯ ɟɐgɐe̯ gelɐm
মেয়ের মা আমার আম্মুকে বলছিল যে আপনাদের টিনের ঘড় দেখে বিয়ে দিছি,Mymensingh মাইয়ার মা আমার আম্মারে কইসিল যে আফনেরার টিনের ঘড় দেইক্ষা বিয়া দিসি, mɪnʃɪn mɐ͡ɪ̯ʲɐɾ mɐ ɐmɐɾ ɐmmɐɾe ko͡ɪ̯sɪlo ɟe ɐpʰoneɾɐɾ tɪneɾ gʱɔɽ d̪e͡ɪ̯kkʰɐ bɪʲɐ d̪
এখন এটার সমাধান কোথায় পাবো,Mymensingh এহন এইডার সমাধান কোনখানে পায়াম,mɪmɪnʃ ehon e͡ɪ̯dɐɾ ʃɔmɐd̪ʱɐn konkʰɐne pɐʲɐm
আমার স্বামী হাসপাতাল এসেছে আমার বাবাকে দেখতে নয় আমাকে নিতে,Mymensingh আমার জামাই হাসপাতাল আইসে আমার আব্বারে দেখতে না আমারে নিতে,mɪmɪng ɐmɐɾ ɟɐmɐ͡ɪ̯ hɐʃpɐt̪ɐl ɐ͡ɪ̯ʃe ɐmɐɾ ɐbbɐɾe d̪ekʰt̪e nɐ ɐmɐɾe nɪt̪e
হাসপাতালে এসেই আমাকে বলে চলো বাসায় যাই,Mymensingh হাসপাতালে আয়াই আমারে কয় চল বাসায় যাই,mɔʲensɪn hɐʃpɐt̪ɐle ɐʲɐ͡ɪ̯ ɐmɐɾe kɔe̯ cɔl bɐʃɐe̯ ɟɐ͡ɪ̯
কালকে আমাদের বাসায় মেহমান আসবে,Mymensingh কালকে আমরার বাসায় মেমান আইব,mɔʲensɪn kɐloke ɐmɾɐɾ bɐʃɐe̯ memɐn ɐ͡ɪ̯bo
মানুষের বিবেকবুদ্ধি কতটা খারাপ হতে পারে,Mymensingh মানুষের বিবেকবুদ্ধি কতডা খারাপ হইতে পারে,menʃɪn mɐnuʃeɾ bɪbekbud̪d̪ʱɪ kɔt̪odɐ kʰɐɾɐp ho͡ɪ̯t̪e pɐɾe
আমার বাবা অসুস্থ হাসপাতালে আর সে এসেছে আমাকে নিতে,Mymensingh আমার আব্বা অসুস্থ হাসপাতালে আর হেয় আইসে আমারে নিতে,mɪmɪng ɐmɐɾ ɐbbɐ ɔʃust̪ʰo hɐʃpɐt̪ɐle ɐɾ hee̯ ɐ͡ɪ̯ʃe ɐmɐɾe nɪt̪e
আমি ওকে বলে দিয়েছি আমি আর তোমার সাথে সংসার করবো না,Mymensingh আমি ওরে কয়া দিসি আমি আর তোমার লগে সংসার করতাম না,mɔʲɐ d̪ɪʃɪ ɐmɪ ɐɾ t̪omɐɾ lɔge ʃɔŋʃɐɾ koɾt̪ɐm nɐ
তোমার সংসারের প্রয়োজন মেটানোর জন্য আমার জন্ম হয়নি,Mymensingh তোমার সংসারের প্রয়োজন মিটানোর লাইজ্ঞা আমার জন্ম হয় নাই,menʃɪn t̪omɐɾ ʃɔŋʃɐɾeɾ pɾoʲoɟon mɪtɐnoɾ lɐ͡ɪ̯ggɐ ɐmɐɾ ɟɔnmo hɔe̯ nɐ͡ɪ̯
আমার বাবার প্রতি আমার কিছু দায়িত্ববোধ আছে,Mymensingh আমার বাপের প্রতি আমার কিসু দায়িত্ববোধ আসে,menʃɪn ɐmɐɾ bɐpeɾ pɾot̪ɪ ɐmɐɾ kɪʃu d̪ɐʲɪt̪t̪obod̪ʱ ɐʃe
অনেক তোমার সংসারে দায়িত্ব পালন করেছি,Mymensingh অনেক তোমার সংসারে দায়িত্ব পালন করসি,menʃɪn ɔnek t̪omɐɾ ʃɔŋʃɐɾe d̪ɐʲɪt̪t̪o pɐlon koɾʃɪ
এখন আমি আমার বাবা দায়িত্ব পালন করব,Mymensingh এহন আমি আমার বাপের দায়িত্ব পালন করবাম,mɔʲenʃɔn ehon ɐmɪ ɐmɐɾ bɐpeɾ d̪ɐʲɪt̪t̪o pɐlon koɾbɐm
আমার স্বামী আমার কথা শুনে রাগে হাসপাতাল থেকে বের হয়ে গেছে,Mymensingh আমার জামাই আমার কথা হুইন্না রাগে হাসপাতাল থাইক্কা বাইর হয়া গেসে,mɪnʃɔn ɐmɐɾ ɟɐmɐ͡ɪ̯ ɐmɐɾ kɔt̪ʰɐ hu͡ɪ̯nnɐ ɾɐge hɐʃpɐt̪ɐl t̪ʰɐ͡ɪ̯kkɐ bɐ͡ɪ̯ɾ hɔʲɐ ges
আমার একটুও কষ্ট হচ্ছে না,Mymensingh আমার একটুও কষ্ট হইতাসে না,mɔʲensɪn ɐmɐɾ ektu͡o̯ koʃto ho͡ɪ̯t̪ɐʃe nɐ
দয়া করে পরিচয় গোপন রাখবেন,Mymensingh দয়া কইরা পরিচয় গোপন রাখবাইন,mɔʲɐ ko͡ɪ̯ɾɐ poɾɪcɔe̯ gopon ɾɐkʰbɐ͡ɪ̯n
আমি জানি না কীভাবে শুরু করবো,Mymensingh আমি জানি না কেমনে শুরু করবাম,mɔʲensɪn ɐmɪ ɟɐnɪ nɐ kɛmone ʃuɾu koɾbɐm
কখনো ভাবিও নাই আমার এখানে পোস্ট করে সাহায্য চাইতে হবে,Mymensingh কহনো ভাবিও নাই আমার এহানে পোস্ট কইরা সাহায্য চাইতে হইব,mɛnʃɪnh kɔhono bʱɐbɪ͡o̯ nɐ͡ɪ̯ ɐmɐɾ ehɐne post ko͡ɪ̯ɾɐ ʃɐhɐɟɟo cɐ͡ɪ̯t̪e ho͡ɪ̯bo
আমি নিজেই অনেক জনকে উপদেশ দিয়েছি,Mymensingh আমি নিজেই অনেক জনরে উপদেশ দিসি,mɔʲenʃɔn ɐmɪ nɪɟe͡ɪ̯ ɔnek ɟɔnoɾe upod̪eʃ d̪ɪʃɪ
এখন নিজেই আর পারছি না,Mymensingh এহন নিজেই আর পারতাসি না,mɔʲensɪn ehon nɪɟe͡ɪ̯ ɐɾ pɐɾt̪ɐʃɪ nɐ
যাইহোক আসল কথায় আসি,Mymensingh যাইহোক আসল কথায় আই,mɔnoʃɪn ɟɐ͡ɪ̯hok ɐʃol kɔt̪ʰɐe̯ ɐ͡ɪ̯
আমার বিয়ে হয়েছে দেড় বছর,Mymensingh আমার বিয়া হইসে দেড় বছর,mɔʲenʃɔn ɐmɐɾ bɪʲɐ ho͡ɪ̯ʃe d̪eɽ bɔcʰoɾ
বলে রাখা ভালো এইটা আমার এবং আমার স্বামীর ২ জনেরই দ্বিতীয় সংসার,Mymensingh কয়া রাহা ভালা এইডা আমার আর আমার জামাইয়ের ২ জনেরই দ্বিতীয় সংসার,mɔʲɐ ɾɐhɐ bʱɐlɐ e͡ɪ̯dɐ ɐmɐɾ ɐɾ ɐmɐɾ ɟɐmɐ͡ɪ̯ʲeɾ nɔ ɟɔneɾɪ d̪ɪt̪ɪʲo ʃɔŋʃɐɾ
"আমার বাবা,ভাই,বোন কেউ নেই","Mymensingh আমার বাপ,ভাই,বোন কেউ নাই"," mɔʲensɪn ɐmɐɾ,bʱɐ͡ɪ̯,bon ke͡u̯ nɐ͡ɪ̯"
আমার বিয়ের ২ মাসের মাথায় আব্বু মারা গেছেন,Mymensingh আমার বিয়ার ২ মাসের মাথায় আব্বা মারা গেসেন,mɔʲensɪn ɐmɐɾ bɪʲɐɾ nɔ mɐʃeɾ mɐt̪ʰɐe̯ ɐbbɐ mɐɾɐ gesen
আমার শুধু আম্মু আছেন,Mymensingh আমার শুধু আম্মা আসেন,mɔʲensɪn ɐmɐɾ ʃud̪ʱu ɐmmɐ ɐʃen
প্রথমে আমার স্বামীর কথায় আসি,Mymensingh প্রথমে আমার জামাইয়ের কথায় আই,menoʃɪn pɾot̪ʰome ɐmɐɾ ɟɐmɐ͡ɪ̯ʲeɾ kɔt̪ʰɐe̯ ɐ͡ɪ̯
আলহামদুলিল্লাহ সে খুব ভালো একজন মানুষ,Mymensingh আলহামদুলিল্লাহ হেয় খুব ভালা একজন মানুষ,mɪnʃɔn ɐlhɐmd̪ulɪllɐh hee̯ kʰub bʱɐlɐ ɛkɟon mɐnuʃ
স্বামী হিসেবে একদম নিখুঁত,Mymensingh জামাই হিসাবে একদম নিখুঁত,menʃɪn ɟɐmɐ͡ɪ̯ hɪʃɐbe ɛkd̪ɔm nɪkʰũt̪
তাকে নিয়ে আমার অভিযোগ এর কোন জায়গা নেই,Mymensingh তারে নিয়া আমার অভিযোগ এর কোন জায়গা নাই,mɔʲensɪn t̪ɐɾe nɪʲɐ ɐmɐɾ obʱɪɟog eɾ kon ɟɐʲgɐ nɐ͡ɪ̯
সমস্যা টা হচ্ছে কয়েক মাস আগে থেকে আমার শাশুড়ী মাকে নিয়ে,Mymensingh সমস্যা টা হইতাসে কয়েক মাস আগে থাইক্কা আমার শাশুড়ী মারে নিয়া,mɔʲenʃɔn ʃɔmoʃʃɐ tɐ ho͡ɪ̯t̪ɐʃe kɔʲek mɐʃ ɐge t̪ʰɐ͡ɪ̯kkɐ ɐmɐɾ ʃɐʃuɽɪ mɐɾe nɪʲɐ
আমি খেয়াল করছি উনি আর উনার ছেলের সম্পর্ক খুব খারাপ,Mymensingh আমি খেয়াল করসি হেয় আর হের পোলার সম্পর্ক খুব খারাপ,mɔʲenʃɔn ɐmɪ kʰeʲɐl koɾʃɪ hee̯ ɐɾ heɾ polɐɾ ʃɔmpoɾko kʰub kʰɐɾɐp
"আমার স্বামীর একটা সমস্যা আছে ,ও একটু চিল্লায় কথা বলে","Mymensingh আমার জামাইয়ের একটা সমস্যা আসে ,ওয় একটু চিল্লায় কথা কয়","mɪmoʃʃɐmɐɾ ɟɐmɐ͡ɪ̯ʲeɾ ɛktɐ ʃɔmoʃʃɐ ɐʃe,oe̯ ektu cɪllɐe̯ kɔt̪ʰɐ kɔe̯"
আমি দেখেছি সব সময় এমন কাজ করেন যার জন্য উনার ছেলে অনেক রাগ করেন,Mymensingh আমি দেখসি বেগ সময় এমন কাম করেন যার লাইজ্ঞা হের পোলা মেলা রাগ করে, mɔe̯ʃɪ beg ʃɔmɔe̯ ɛmon kɐm kɔɾen ɟɐɾ lɐ͡ɪ̯ggɐ heɾ polɐ mɛlɐ ɾɐg koɾe
কিছু বললে উনি সেইটা অন্যভাবে নিয়ে চিল্লাচিল্লি করেন,Mymensingh কিসু কইলে হেয় ওইডা অন্যভাবে নিয়া চিল্লাচিল্লি করে,mɔʃenogho kɪʃu ko͡ɪ̯le hee̯ o͡ɪ̯dɐ ɔnnobʱɐbe nɪʲɐ cɪllɐcɪllɪ koɾe
উনি যেইটা বলবে সেইটাই ঠিক আর সেইটাই করবে,Mymensingh উনি যেইডা কইব ওইডাই ঠিক আর ওইডাই করব,menʃɪn unɪ ɟe͡ɪ̯dɐ ko͡ɪ̯bo o͡ɪ̯dɐ͡ɪ̯ tʰɪk ɐɾ o͡ɪ̯dɐ͡ɪ̯ koɾbo
কারো কথা উনি শুনেন না,Mymensingh কারো কথা হেয় হুনে না,mɔʲenʃɪn kɐɾo kɔt̪ʰɐ hee̯ hune nɐ
উনার কারো সাথে ভালো সম্পর্ক নেই,Mymensingh হের কারো লগে ভালা সম্পর্ক নাই,menʃɪnho heɾ kɐɾo lɔge bʱɐlɐ ʃɔmpoɾko nɐ͡ɪ̯
আমার স্বামীর সবকিছুতে উনি দোষ দেখেন,Mymensingh আমার জামাইয়ের বেগকিসুতে হেয় দোষ দেহে,mɪmɪng ɐmɐɾ ɟɐmɐ͡ɪ̯ʲeɾ begokɪʃut̪e hee̯ d̪oʃ d̪ehe
সবাইকে বলেন ইদানীং আমার ছেলে বদলে গেছে,Mymensingh সবাইরে কয় ইদানীং আমার পোলা বদলায়া গেসে,menʃɪn ʃɔbɐ͡ɪ̯ɾe kɔe̯ ɪd̪ɐnɪŋ ɐmɐɾ polɐ bɔd̪lɐʲɐ gese
গতকাল একটা ছোট বিষয় নিয়ে বলেন বিয়ের পর ছেলেরা কেমন বদলে যায়,Mymensingh গতকাল একটা ছোট বিষয় নিয়া কইলেন বিয়ার পরে পোলারা কেমন বদলায়া যায়,menʃɪnh gɔt̪okɐl ɛktɐ cʰoto bɪʃɔe̯ nɪʲɐ ko͡ɪ̯len bɪʲɐɾ pɔɾe polɐɾɐ kɛmon bɔd̪lɐʲɐ ɟɐe̯
উনাদের মা ছেলের সম্পর্ক খারাপ এর প্রভাব আমার উপর আসে,Mymensingh হেরার মা পোলার সম্পর্ক খারাপ এর প্রভাব আমার উপর আয়,menʃɪnho heɾɐɾ mɐ polɐɾ ʃɔmpoɾko kʰɐɾɐp eɾ pɾobʱɐb ɐmɐɾ upoɾ ɐe̯
আমি আমার স্বামীর সাথে রাগ করি কেনো তাদের এরকম কথা কাটাকাটি হয়,Mymensingh আমি আমার জামাইয়ের লগে রাগ করি কেরে তারার এরকম কথা কাটাকাটি হয়,mɔʲensɪn ɐmɪ ɐmɐɾ ɟɐmɐ͡ɪ̯ʲeɾ lɔge ɾɐg koɾɪ keɾe t̪ɐɾɐɾ eɾokom kɔt̪ʰɐ kɐtɐkɐtɪ hɔe̯
ও আমাকে কোন কাজে সাহায্য করে,Mymensingh ও আমারে কোন কামে সাহায্য করে,mɔnoʃɪn o ɐmɐɾe kon kɐme ʃɐhɐɟɟo koɾe
"কিছু কিনে দিতে চাইলে,কোথায় ঘুরতে নিয়ে যেতে চাইলে উনি সেইটা ভালোভাবে নেন না","Mymensingh কিসু কিন্না দিতে চাইলে,কোথায় ঘুরতে নিয়া যাইতে চাইলে হেয় হেইডা ভালোভাবে লন না","mɔnoʃɪn kɪʃu kɪnnɐ d̪ɪt̪e cɐ͡ɪ̯le,kot̪ʰɐe̯ gʱuɾt̪e nɪʲɐ ɟɐ͡ɪ̯t̪e cɐ͡ɪ̯le hee̯ he͡ɪ̯dɐ b"
আমাদের আর উনাদের সময় তো এক না,Mymensingh আমরার আর হেরার সময় তো এক না,mɔʲensɪg ɐmɾɐɾ ɐɾ heɾɐɾ ʃɔmɔe̯ t̪o ɛk nɐ
আমার বাসার কেউ আসলে উনি বাসায় ঝগড়াঝাটি শুরু করে দেন,Mymensingh আমার বাসার কেউ আইলে উনি বাসায় ঝগড়াঝাটি শুরু কইরা দেন,mɪmɪnʃ ɐmɐɾ bɐʃɐɾ ke͡u̯ ɐ͡ɪ̯le unɪ bɐʃɐe̯ ɟʱɔgɽɐɟʱɐtɪ ʃuɾu ko͡ɪ̯ɾɐ d̪ɛn
আমার স্বামী বাসায় কিছু আনলে সবার জন্য নিয়ে আসেন,Mymensingh আমার জামাই বাসায় কিসু আনলে সবার লাইজ্ঞা নিয়া আসেন,mɔʲenog ɐmɐɾ ɟɐmɐ͡ɪ̯ bɐʃɐe̯ kɪʃu ɐnole ʃɔbɐɾ lɐ͡ɪ̯ggɐ nɪʲɐ ɐʃen
তাও মার অভিযোগ ও কিছু আনে না,Mymensingh তাও আম্মার অভিযোগ হেয় কিসু আনে না,mɔʲensɪn t̪ɐ͡o̯ ɐmmɐɾ obʱɪɟog hee̯ kɪʃu ɐne nɐ
কিন্তু আমি নিজেই দেখেছি ও মাকে কত ভালোবাসে,Mymensingh কিন্তু আমি নিজেই দেখসি ওয় মারে কত ভালবাসে,menʃɪnho kɪnt̪u ɐmɪ nɪɟe͡ɪ̯ d̪ekʰʃɪ oe̯ mɐɾe kɔt̪o bʱɐlbɐʃe
এইটা ওইটা কিনে দিতে চাইলে বলে টাকা নষ্ট করিস না,Mymensingh এইডা ওইডা কিন্না দিতে চাইলে কয় টাকা নষ্ট করিস না,mɔʃenʃɔn e͡ɪ̯dɐ o͡ɪ̯dɐ kɪnnɐ d̪ɪt̪e cɐ͡ɪ̯le kɔe̯ tɐkɐ nɔʃto koɾɪʃ nɐ
আমার আম্মু আসছে আমাদের বাসায় ৬ মাস পরে,Mymensingh আমার আম্মা আইসে আমরার বাসায় ৬ মাস পরে,mɪmɪng ɐmɐɾ ɐmmɐ ɐ͡ɪ̯ʃe ɐmɾɐɾ bɐʃɐe̯ bo mɐʃ pɔɾe
আম্মুর সামনে উনারা যা তা ঝগড়া করেন,Mymensingh আম্মার সামনে হেরা যা তা ঝগড়া করেন,mɔʲensɪn ɐmmɐɾ ʃɐmne heɾɐ ɟɐ t̪ɐ ɟʱɔgɽɐ kɔɾen
ভালো ব্যবহার করেন না,Mymensingh ভালা ব্যবহার করেন না,menʃɪn bʱɐlɐ bɛbohɐɾ kɔɾen nɐ
একসাথে বসে খায় ও না,Mymensingh একলগে বয়া খায় ও না,mɔʲenʃɪg ɛklgk bɔʲɐ kʰɐe̯ o nɐ
আম্মু এসব দেখে খুব কষ্ট পাচ্ছেন যেহেতু আমার বাবা নেই,Mymensingh আম্মা এসব দেইক্ষা মেলা কষ্ট পাইসেন যেহেতু আমার আব্বা নাই,mɪmɪng ɐmmɐ eʃɔb d̪e͡ɪ̯kkʰɐ mɛlɐ koʃto pɐ͡ɪ̯sen ɟehet̪u ɐmɐɾ ɐbbɐ nɐ͡ɪ̯
আমার স্বামী এসব নিয়ে কিছু বলতে গেলে উনি মনে করেন বউ ছেলের হয়ে গেছে,Mymensingh আমার জামাই এসব নিয়া কিসু কইতে গেলে হেয় মনে করেন বউ পোলার হয়া গেসে,mɔʲenʃɔn ɐmɐɾ ɟɐmɐ͡ɪ̯ eʃɔb nɪʲɐ kɪʃu ko͡ɪ̯t̪e gele hee̯ mone kɔɾen bɔ͡u̯ polɐɾ hɔʲɐ gese
উনার আরো একটা ছেলে আছে,Mymensingh হের আরো একটা পোলা আসে, menʃɪn heɾ ɐɾo ɛktɐ polɐ ɐʃe
সে চাকরি করে বিয়ে বিয়ে করে নাই,Mymensingh হেয় চাকরি করে বিয়া বিয়া করে নাই,menoʃɪn hee̯ cɐkɾɪ koɾe bɪʲɐ bɪʲɐ koɾe nɐ͡ɪ̯
মার কাছে ছোটো ছেলেই সব,Mymensingh মার কাসে ছোটো পোলাই সব,menʃɪn mɐɾ kɐʃe cʰoto polɐ͡ɪ̯ ʃɔb
তার ছোটো ছেলের কোন দোষ নেই,Mymensingh হের ছোটো পোলার কোন দোষ নাই,mɔʲenʃɪn heɾ cʰoto polɐɾ kon d̪oʃ nɐ͡ɪ̯
আমি নিজে দেখেছি সে কেমন বাজে ব্যবহার করে মায়ের সাথে,Mymensingh আমি নিজে দেখসি হেয় কেমন বাজে ব্যবহার করে মায়ের লগে,mɪnoʃe ɐmɪ nɪɟe d̪ekʰʃɪ hee̯ kɛmon bɐɟe bɛbohɐɾ koɾe mɐʲeɾ lɔge
সংসার এর সব খরচ আমার জামাই দেয়,Mymensingh সংসার এর বেগ খরচ আমার জামাই দেয়,mɪmɪng ʃɔŋʃɐɾ eɾ beg kʰɔɾoc ɐmɐɾ ɟɐmɐ͡ɪ̯ d̪ee̯
সব কাজ আমি করি উনি একটা কাজ ও করেন না তাও আমরা খারাপ,Mymensingh বেগ কাম আমি করি হেয় একটা কাম ও করেন না তাও আমরা খারাপ,menʃɪnh beg kɐm ɐmɪ koɾɪ hee̯ ɛktɐ kɐm o kɔɾen nɐ t̪ɐ͡o̯ ɐmɾɐ kʰɐɾɐp
আমার চাচা শ্বশুর সবাই আলহামদুলিল্লাহ নিজেদের বাড়ি গাড়ি করে ফেলেছেন,Mymensingh আমার চাচা শ্বশুর বেহেই আলহামদুলিল্লাহ নিজেরার বাড়ি গাড়ি কইরা ফালাইসেন,mɪnʃɪn ɐmɐɾ cɐcɐ ʃoʃuɾ behe͡ɪ̯ ɐlhɐmd̪ulɪllɐh nɪɟeɾɐɾ bɐɽɪ gɐɽɪ ko͡ɪ̯ɾɐ pʰɐlɐ͡ɪ̯sen
উনি নামাজ কালাম ও ঠিক মত পড়েন না,Mymensingh উনি নামাজ কালাম ও ঠিক মত পড়েন না,mɔʲenʃɔn unɪ nɐmɐɟ kɐlɐm o tʰɪk mɔt̪ pɔɽen nɐ
আমি এখন এইগুলো মেনে নিতে পারছি না,Mymensingh আমি এহন এইগুলা মাইন্না নিতাম পারতাসি না,mɔʲensɪn ɐmɪ ehon e͡ɪ̯gulɐ mɐ͡ɪ̯nnɐ nɪt̪ɐm pɐɾt̪ɐʃɪ nɐ
আমি চাচ্ছি আলাদা বাসায় চলে যাবো আমরা,Mymensingh আমি চাইতাসি আলাদা বাসায় চইল্লা যায়াম আমরা, mɔʲɪng ɐmɪ cɐ͡ɪ̯t̪ɐʃɪ ɐlɐd̪ɐ bɐʃɐe̯ co͡ɪ̯llɐ ɟɐʲɐm ɐmɾɐ
এইটা কি ঠিক সিদ্ধান্ত হবে আমাদের জন্য?,Mymensingh এইডা কি ঠিক সিদ্ধান্ত হইব আমরার লাইজ্ঞা?, mɔʲenʃɔn e͡ɪ̯dɐ kɪ tʰɪk ʃɪd̪d̪ʱɐnt̪o ho͡ɪ̯bo ɐmɾɐɾ lɐ͡ɪ̯ggɐ?
আমার বিয়ে হয়েছে চার বছর,Mymensingh আমার বিয়া হইসে চাইর বছর,mɔʲenʃɔn ɐmɐɾ bɪʲɐ ho͡ɪ̯ʃe cɐ͡ɪ̯ɾ bɔcʰoɾ
আমার মা মারা গেছে আট মাস আগে,Mymensingh আমার মা মারা গেসে আট মাস আগে,mɔnoʃɪn ɐmɐɾ mɐ mɐɾɐ gese ɐt mɐʃ ɐge
আমি আমার বাবা মার একমাত্র সন্তান,Mymensingh আমি আমার বাপ মার একমাত্র সন্তান,mɔʲensɪn ɐmɪ ɐmɐɾ bɐp mɐɾ ɛkmɐt̪ɾo ʃɔnt̪ɐn
মা মরে যাওয়ার পর বাবা খুব একা হয়ে গিয়েছে,Mymensingh মা মইরা যাওনের পর আব্বা খুব একা হয়া গেসে, mɔʲenʃɔn mɐ mo͡ɪ̯ɾɐ ɟɐ͡o̯neɾ pɔɾ ɐbbɐ kʰub ɛkɐ hɔʲɐ gese
তাকে দেখার মত তেমন কেউ নেই,Mymensingh তারে দেহার মত তেমন কেউ নাই,menʃɪn t̪ɐɾe d̪ehɐɾ mɔt̪ t̪ɛmon ke͡u̯ nɐ͡ɪ̯
আমি আমার সাধ্য অনুযায়ী চেষ্টা করি বাবার খোঁজ খবর নিতে,Mymensingh আমি আমার সাধ্য অনুযায়ী চেষ্টা করি আব্বার খোঁজ খবর নিতে,menʃɪnho ɐmɪ ɐmɐɾ ʃɐd̪d̪ʱo onuʲɐʲɪ ceʃtɐ koɾɪ ɐbbɐɾ kʰõɟ kʰɔboɾ nɪt̪e
আমার শ্বশুরবাড়ির লোকজন এটা একেবারেই পছন্দ করে না,Mymensingh আমার শ্বশুরবাড়ির লোকজন এটা এক্কেরেই পসন্দ করে না,mɔʃɪnho ɐmɐɾ ʃoʃuɾbɐɽɪɾ lokɟɔn etɐ ɛkkeɾe͡ɪ̯ pɔʃond̪o koɾe nɐ
বাবার খোঁজখবর রাখার চেষ্টা করি সব সময়,Mymensingh আব্বার খোঁজখবর রাখার চেষ্টা করি বেগ সময়,mɔʲensɪn ɐbbɐɾ kʰõɟkʰɔbɔɾ ɾɐkʰɐɾ ceʃtɐ koɾɪ beg ʃɔmɔe̯
আমার স্বামী এবং তার বাড়ির লোকজন কোনভাবেই রাজি না,Mymensingh আমার জামাই আর হের বাড়ির লোকজন কোনভাবেই রাজি না,menʃɪn ɐmɐɾ ɟɐmɐ͡ɪ̯ ɐɾ heɾ bɐɽɪɾ lokɟɔn konbʱɐbe͡ɪ̯ ɾɐɟɪ nɐ
