bangla_speech,combined,ipa_output
হায়রে মানুষ একজন আরেকজনের প্রতি হিংসা করে,Mymensingh হায়রে মানুষ একজন আরেকজনের প্রতি হিংসা করে,menʃɪn hɐʲɾe mɐnuʃ ɛkɟon ɐɾekɟɔneɾ pɾot̪ɪ hɪŋʃɐ koɾe
আমি আমার বাসার সামনের খেলার মাঠে খেলি ,Mymensingh আমি আমার বাসার সামনের খেলার মাঠে খেলি ,mɔʲensɪn ɐmɪ ɐmɐɾ bɐʃɐɾ ʃɐmoneɾ kʰelɐɾ mɐtʰe kʰelɪ 
আম দিয়ে শরবত বানিয়ে খাও ,Mymensingh আম দিয়া শরবত বানায়া খাও ,mɔnoʃɪn ɐm d̪ɪʲɐ ʃɔɾbot̪ bɐnɐʲɐ kʰɐ͡o̯ 
ঠাণ্ডা শরবত খেলে ভালো লাগবে তোমার ,Mymensingh ঠাণ্ডা শরবত খাইলে ভালা লাগব তোমার ,mɔnoʃɔn tʰɐndɐ ʃɔɾbot̪ kʰɐ͡ɪ̯le bʱɐlɐ lɐgbo t̪omɐɾ 
এতো চিন্তা করা লাগবে না নিজেরে নিয়ে ভাবো ,Mymensingh এতো চিন্তা করা লাগব না নিজেরে নিয়া ভাবো ,menʃɪnh et̪o cɪnt̪ɐ kɔɾɐ lɐgbo nɐ nɪɟeɾe nɪʲɐ bʱɐbo 
আমকে আমাদের দেশে ‘ফলের রাজা’ বলা হয়,Mymensingh আমরে আমরার দেশে ‘ফলের রাজা’ কওয়ন হয়,mɔʲensɪn ɐmɾe ɐmɾɐɾ d̪eʃe 'ʱɔpʰɔleɾ ɾɐɟɐ' kɔ͡o̯ʲon hɔe̯
তুমি দেখতে সুন্দর না হলেও আমি তোমাকেই চাই,Mymensingh তুমি দেখতে সুন্দর না হইলেও আমি তোমারেই চাই,mɔʲensɪng t̪umɪ d̪ekʰt̪e ʃund̪ɔɾ nɐ ho͡ɪ̯le͡o̯ ɐmɪ t̪omɐɾe͡ɪ̯ cɐ͡ɪ̯
সেখানে অনেক পুলিশ দেখে বাসার দিকে ফিরছিলাম,Mymensingh ওইহানে মেলা পুলিশ দেইক্ষা বাসার দিকে ফিরছিলাম,mɪnʃɪn o͡ɪ̯hɐne mɛlɐ pulɪʃ d̪e͡ɪ̯kkʰɐ bɐʃɐɾ d̪ɪke pʰɪɾcʰɪlɐm
বুঝে উঠতে পারছিলাম না কী করবো,Mymensingh বুইজ্ঝা উঠতে পারতাসিলাম না কীতা করবাম , menʃɪn bu͡ɪ̯ɟɟʱɐ utʰt̪e pɐɾt̪ɐʃɪlɐm nɐ kɪt̪ɐ koɾbɐm 
তোমার সব কথা  ঠিক আছে,Mymensingh তোমার বেক কথা ঠিক আছে,menʃɪn t̪omɐɾ bek kɔt̪ʰɐ tʰɪk ɐcʰe
আমি ভালো ছেলে,Mymensingh আমি ভালা ছেলে,menoʃɔg ɐmɪ vɐlɐ cʰele
বিয়ের জন্য আব্বা আমার জন্য মেয়ে খুজতাসে,Mymensingh বিয়ার লাইগা আব্বা আমার লাইগা মেয়ে খুজতাসে, mɔʲɪng bɪʲɐɾ lɐ͡ɪ̯gɐ ɐbbɐ ɐmɐɾ lɐ͡ɪ̯gɐ meʲe kʰuɟt̪ɐʃe
আম্মা আমাকে গতকাল একটা ছেলের সাথে দেখা করতে বলেছিলও,Mymensingh আম্মা আমারে গতকাল একটা ছেলের সাথে দেখা করতে কইসিল,mɪnʃɪn ɐmmɐ ɐmɐɾe gɔt̪okɐl ɛktɐ cʰeleɾ ʃɐt̪ʰe d̪ɛkʰɐ koɾt̪e ko͡ɪ̯sɪl
ছেলেটিকে আমার ভাল লেগেছে,Mymensingh ছেড়াটারে আমার ভাল লাগছে,mɔnoʃɪng cʰeɽɐtɐɾe ɐmɐɾ bʱɐlo lɐgcʰe
ছেলেটি হয়ত অন্য কোনও মেয়েকে ভালবাসে,Mymensingh ছেড়াটা হয়তো অন্য কোনও ছেড়িরে ভালবাসে,mɔʲenʃɪng cʰeɽɐtɐ hɔʲt̪o ɔnno kono cʰeɽɪɾe bʱɐlbɐʃe
মেয়েটি ছেলেটার অপেক্ষায় থাকে,Mymensingh ছেড়িটা ছেড়াটার অপেক্ষায় থাকে,menoʃɪng cʰeɽɪtɐ cʰeɽɐtɐɾ ɔpekkʰɐe̯ t̪ʰɐke
ছেলেটি কেন যে মেয়েটার মনের কথা বুঝে না,Mymensingh ছেড়াটা কিল্লেগা যে ছেড়িটার মনের কথা বুঝেনা,mɔnoʃɪnh cʰeɽɐtɐ kɪllegɐ ɟe cʰeɽɪtɐɾ moneɾ kɔt̪ʰɐ buɟʱenɐ
মেয়েটি হয়ত ছেলেটাকে তাঁর মনের কথা ভাল ভাবে বুঝাতে পারেনাই,Mymensingh ছেড়িটা হয়তো ছেড়াটারে তার মনের কথা ভালাভাবে বুঝাইতে পারে নাই,mɔʲensɪng cʰeɽɪtɐ hɔʲt̪o cʰeɽɐtɐɾe t̪ɐɾ moneɾ kɔt̪ʰɐ bʱɐlɐbʱɐbe buɟʱɐ͡ɪ̯t̪e pɐɾe nɐ͡ɪ̯
হয়ত কোন একদিন ছেলেটি মেয়েটাকে ভালবাসবে,Mymensingh হয়তো কোন একদিন ছেড়াটা ছেড়িটারে ভালবাসবো,mɔʲt̪o kon ɛkd̪ɪn cʰeɽɐtɐ cʰeɽɪtɐɾe bʱɐlbɐʃbo
তুমি আমাকে দয়া করে আর বিরক্ত করো না,Mymensingh তুমি আমারে দয়া কইরা আর বিরক্ত কইরোনা,mɔʲenʃɔn t̪umɪ ɐmɐɾe d̪ɔʲɐ ko͡ɪ̯ɾɐ ɐɾ bɪɾokt̪o ko͡ɪ̯ɾonɐ
সে তাকে অনেক বিরক্ত করে,Mymensingh সে তারে অনেক বিরক্ত করে,menʃɪn ʃe t̪ɐɾe ɔnek bɪɾokt̪o koɾe
তাকে নিয়ে আমি আমার গ্রামের বাড়িতে ঘুরতে যেতে চাই,Mymensingh তারে নিয়া আমি আমার গ্রামের বাড়ি ঘুরতে যাইতে চাই,mɪnʃɪn t̪ɐɾe nɪʲɐ ɐmɪ ɐmɐɾ gɾɐmeɾ bɐɽɪ gʱuɾt̪e ɟɐ͡ɪ̯t̪e cɐ͡ɪ̯
এইবার ছুটিতে সিলেট ঘুরতে যাব,Mymensingh এইবার ছুটিতে সিলেট ঘুরতে যামু,menʃɪn e͡ɪ̯bɐɾ cʰutɪt̪e sɪlet gʱuɾt̪e ɟɐmu
আমি যাকে ভালবাসি সে সিলেটে থাকে,Mymensingh আমি যারে ভালবাসি সে সিলেটে থাকে,menʃɪn ɐmɪ ɟɐɾe bʱɐlbɐʃɪ ʃe sɪlete t̪ʰɐke
আমার এখন বইটা লাগবে নাহ,Mymensingh আমার এহন বইডা লাগতোনা,menʃɪn ɐmɐɾ ehon bo͡ɪ̯dɐ lɐgt̪onɐ
তুমি কি এই বইটি পড়তে চাও ?,Mymensingh তুমি কি এই বইডা পড়তে চাও?,mɔʲenʃɪn t̪umɪ kɪ e͡ɪ̯ bo͡ɪ̯dɐ poɽt̪e cɐ͡o̯?
সে  কি এই বইটি পড়তে চায়  ?,Mymensingh সে কি এই বইডা পড়তে চায়?,mɔʲenʃɪn ʃe kɪ e͡ɪ̯ bo͡ɪ̯dɐ poɽt̪e cɐe̯?
আপনি  কি এই বইটি পড়তে চান  ?,Mymensingh আফনে এই বইডা পড়তে চান ?,menʃɪn ɐcʰone e͡ɪ̯ bo͡ɪ̯dɐ poɽt̪e cɐn?
আমার বই পরতে অনেক ভাল লাগে,Mymensingh আমার বই পড়তে মেলা ভালালাগে,mɔnoʃɔn ɐmɐɾ bo͡ɪ̯ poɽt̪e mɛlɐ bʱɐlɐlɐge
তোমার আমাকে চিনতে হবে না   ,Mymensingh তোমারে আমার চিনতে হইবোনা,mɔʲensɪn t̪omɐɾe ɐmɐɾ cɪnt̪e ho͡ɪ̯bonɐ
অনেক রাত হয়েছে এখন ঘুমিয়ে যাও ,Mymensingh মেলা রাইত হইসে এহন ঘুমায়া যাও,mɔʲenʃɪn mɛlɐ ɾɐ͡ɪ̯t̪o ho͡ɪ̯ʃe ehon gʱumɐʲɐ ɟɐ͡o̯
তোমাকে পড়ালেখা করতে হবে,Mymensingh তোমার পড়ালেহা করতে হইব,mɔʲensɪng t̪omɐɾ pɔɽɐlehɐ koɾt̪e ho͡ɪ̯bo
তোমার পড়ালেখা করতে ভাল লাগে না?,Mymensingh তোমার পড়ালেহা করতে ভালালাগেনা?,menos t̪omɐɾ pɔɽɐlehɐ koɾt̪e bʱɐlɐlɐgenɐ?
আমাকে পড়ালেখা করতে হবে,Mymensingh আমার পড়ালেহা করতে হইব,menʃɪn ɐmɐɾ pɔɽɐlehɐ koɾt̪e ho͡ɪ̯bo
সে  অনেক ভালো রান্না করে,Mymensingh হেয় অনেক ভালা রানদে,mɔnoʃɪng hee̯ ɔnek bʱɐlɐ ɾɐnd̪e
আমি  একটি বিদ্যালয়  পড়ালেখা করি ,Mymensingh আমি একটা ইস্কুলে পড়ালেহা করি,menʃɪn ɐmɪ ɛktɐ ɪskule pɔɽɐlehɐ koɾɪ
আমার ছোট বোন একটি বিদ্যালয়ে পড়ে,Mymensingh আমার ছোট বইন একটা ইস্কুলে পড়ে,menʃɪn ɐmɐɾ cʰoto bo͡ɪ̯n ɛktɐ ɪskule pɔɽe
আমার ছোট ভাই  একটি বিদ্যালয়ে  পড়ালেখা করে,Mymensingh আমার ছোট ভাই একটা ইস্কুলে পড়ালেহা করে,menʃɪn ɐmɐɾ cʰoto bʱɐ͡ɪ̯ ɛktɐ ɪskule pɔɽɐlehɐ koɾe
আমার বিদ্যালয়ে  যেতে ভাল লাগে না,Mymensingh আমার ইস্কুলে যাইতে ভালা লাগেনা,menʃɪn ɐmɐɾ ɪskule ɟɐ͡ɪ̯t̪e bʱɐlɐ lɐgenɐ
আমার বিয়ের বয়স পার হয়ে যাচ্ছে,Mymensingh আমার বিয়ার বয়স পার হয়া যাইতাসেগা,mɔʲensɪn ɐmɐɾ bɪʲɐɾ bɔʲoʃ pɐɾ hɔʲɐ ɟɐ͡ɪ̯t̪ɐʃegɐ
আহারে তোমার মনে কতো দুঃখ,Mymensingh আহার তুমার মনে কত দুঃখ,mɔʲensɪn ɐhɐɾ t̪umɐɾ mone kɔt̪o d̪ukkʰo
আমি ঘুমাতে যাবো,Mymensingh আমি ঘুমাইতে যায়াম,menʃɔn ɐmɪ gʱumɐ͡ɪ̯t̪e ɟɐʲɐm
আমি নাচতে পারি,Mymensingh আমি নাচতাম পারি,menʃɔn ɐmɪ nɐct̪ɐm pɐɾɪ
আমি সাঁতার কাটতে পছন্দ করি ,Mymensingh আমি হাতার কাটতাম পছন্দ করি,menʃɪn ɐmɪ hɐt̪ɐɾ kɐtt̪ɐm pɔcʰond̪o koɾɪ
আমি তোমার বাসায় ঘুরতে আসবো,Mymensingh আমি তোমার বাসায় ঘুরতে আয়াম,menʃɪn ɐmɪ t̪omɐɾ bɐʃɐe̯ gʱuɾt̪e ɐʲɐm
সে তার গ্রামের বাড়িতে ঘুরতে গিয়েছে,Mymensingh হেয় হের গেরামের বারিত ঘুরতে গেসে,mɔʲensɪng hee̯ heɾ geɾɐmeɾ bɐɾɪt̪ɔ gʱuɾt̪e gese
আমার বন্ধু মানসিক ভাবে দুর্বল,Mymensingh আমার বন্ধু মানসিক ভাবে দুর্বল,mɔnoʃɪn ɐmɐɾ bond̪ʱu mɐnoʃɪk bʱɐbe d̪uɾbol
এমন অবস্থায় তার কি করা উচিত ?,Mymensingh এমন অবস্থাতে হের কিতা করন উচিত?,menʃɪng ɛmon ɔbost̪ʰɐt̪e heɾ kɪt̪ɐ kɔɾon ucɪt̪?
আমার দুইটি বাবু আছে,Mymensingh আমার দুইটা আবু আসে,mɔʲensɪn ɐmɐɾ d̪u͡ɪ̯tɐ ɐbu ɐʃe
আমার স্বামীকে আমি খুব ভালোবাসি,Mymensingh আমার জামাইরে আমি মেলা ভালবাসি,mɔnosɪng ɐmɐɾ ɟɐmɐ͡ɪ̯ɾe ɐmɪ mɛlɐ bʱɐlbɐʃɪ
অনেক দিন পর আপনার সাথে দেখা,Mymensingh মেলাদিন পরে আফনের সাথে দেহা,mɔʲenʃɪn pɔɾe ɐpʰoneɾ ʃɐt̪ʰe d̪ehɐ
আপনি কেমন আছেন ?,Mymensingh আফনে কেমন আসেন,menʃɪn ɐcʰone kɛmon ɐʃen
আপনার কি আমার কথা মনে আছে এখনও ?,Mymensingh আফনের কি আমার কথা মনে আসে এহনও?,mɔʲenʃɔn ɐpʰoneɾ kɪ ɐmɐɾ kɔt̪ʰɐ mone ɐʃe ehono?
আমার পড়ালেখা করতে ভালো লাগে নাহ,Mymensingh আমার পড়ালেহা করতে ভালা লাগে নাহ,menoʃɔg ɐmɐɾ pɔɽɐlehɐ koɾt̪e bʱɐlɐ lɐge nɐh
আমার বিদেশে গিয়ে পড়ালেখা করার স্বপ্ন,Mymensingh আমার বিদেশে যায়া পড়ালেহা করার স্বপ্ন,mɔnoʃɪn ɐmɐɾ bɪd̪eʃe ɟɐʲɐ pɔɽɐlehɐ kɔɾɐɾ ʃɔpno
আপনার সাথে কথা বলে অনেক ভালো লাগলো,Mymensingh আফনের লগে কথা কয়া মেলা ভালা লাগলো,menʃɪn ɐpʰoneɾ lɔge kɔt̪ʰɐ kɔʲɐ mɛlɐ bʱɐlɐ lɐglo
অনেকে বলে প্রেম করলে মানুষ বোকা হয়,Mymensingh অনেকে কয় প্রেম করলে মাইনষে বেক্কল হয়,mɔʃenʃe ɔneke kɔe̯ pɾem koɾle mɐ͡ɪ̯nʃe bekkol hɔe̯
অনেকে আরো বলে যে বিয়ে করলে মানুষ নাকি গাধা হয়,Mymensingh অনেকে আরো কয় যে বিয়া করলে মাইনষে নাকি গাধা হয়,mɔʃenʃe ɐɾo kɔe̯ ɟe bɪʲɐ koɾle mɐ͡ɪ̯nʃe nɐkɪ gɐd̪ʱɐ hɔe̯
একজন লোক মারা গেছেন,Mymensingh একজন বেডা মারা গেসেন,mɔʲenʃɔn ɛkɟon bedɐ mɐɾɐ gesen
তুমি এত গরীব আগে কেন বলোনি,Mymensingh তুমি এত গরিব আগে কেন কও নাই,mɔʲenʃɪn t̪umɪ ɛt̪o goɾɪb ɐge keno kɔ͡o̯ nɐ͡ɪ̯
আমি আগেই বলেছি তুমি ছাড়া এই পৃথিবীতে আমার আর কিছুই নাই,Mymensingh আমি আগেও কইসি তুমি ছাড়া এই দুনিয়াতে আমার আর কিসুই নাই,mɔʲenʃɪn ɐmɪ ɐge͡o̯ ko͡ɪ̯ʃɪ t̪umɪ cʰɐɽɐ e͡ɪ̯ d̪unɪʲɐt̪e ɐmɐɾ ɐɾ kɪʃu͡ɪ̯ nɐ͡ɪ̯
মনের ভালোবাসা চিরদিন থেকে যাবে,Mymensingh মনের ভালোবাসা চিরদিন থাইক্কা যাইব,menʃɪn moneɾ bʱɐlobɐʃɐ cɪɾod̪ɪn t̪ʰɐ͡ɪ̯kkɐ ɟɐ͡ɪ̯bo
জীবনের কিছুটা পথ একা একা চলা তেমন কঠিন নয়,Mymensingh জীবনের কিসুটা পথ একলা চলা তেমন কঠিন না,mɔʃɔneɾ kɪʃutɐ pɔt̪ʰ ɛklɐ cɔlɐ t̪ɛmon kotʰɪn nɐ
জীবন হলো বাঁচার  জন্য,Mymensingh জীবন হইলো বাঁচার লাইজ্ঞা,menʃɪn ɟɪbɔn ho͡ɪ̯lo bɐ̃cɐɾ lɐ͡ɪ̯ggɐ
মন  হলো দেবার জন্য,Mymensingh মন হইলো দেয়ার লাইজ্ঞা,menʃɪn mon ho͡ɪ̯lo d̪eʲɐɾ lɐ͡ɪ̯ggɐ
ভালবাসা  হলো সারা জীবন  পাশে থাকার জন্য,Mymensingh ভালবাসা হইলো সারাজীবন পাশে থাকার লাইজ্ঞা,mɔʲenʃɔn bʱɐlbɐʃɐ ho͡ɪ̯lo ʃɐɾɐɟɪbɔn pɐʃe t̪ʰɐkɐɾ lɐ͡ɪ̯ggɐ
আমি কিছু ভাবতে পারিনা তোমায় ছাড়া,Mymensingh আমি কিসু ভাবতে ফারিনা তোমারে ছাড়া,menʃɪn ɐmɪ kɪʃu bʱɐbt̪e pʰɐɾɪnɐ t̪omɐɾe cʰɐɽɐ
আমি কিছু লিখতে পারিনা তোমার নাম ছাড়া,Mymensingh আমি কিসু লিখতাম ফারিনা তোমার নাম ছাড়া,mɔnoʃɔn ɐmɪ kɪʃu lɪkʰt̪ɐm pʰɐɾɪnɐ t̪omɐɾ nɐm cʰɐɽɐ
আমি কিছু বুঝতে চাইনা তোমায় ছাড়া ,Mymensingh আমি কিসু বুঝতাম চাই না তোমারে ছাড়া,mɔʲensɪn ɐmɪ kɪʃu buɟʱt̪ɐm cɐ͡ɪ̯ nɐ t̪omɐɾe cʰɐɽɐ
ভালবাসায় এমন কেন হয়?,Mymensingh ভালবাসায় এমন কেরে হয়?,menʃɪnh bʱɐlbɐʃɐe̯ ɛmon keɾe hɔe̯?
যখন ছেলে বুঝে তখন মেয়ে বুঝেনা ,Mymensingh যখন ছেড়া বুঝে তখন ছেড়ি বুঝেনা !,mɔnoʃɪn ɟɔkʰon cʰeɽɐ buɟʱe t̪ɔkʰon cʰeɽɪ buɟʱenɐ!
ভালোবাসি তোমাকে বলা বাকি,Mymensingh ভালবাসি তোমারে কওয়া বাকি,menʃɔn bʱɐlbɐʃɪ t̪omɐɾe koʷɐ bɐkɪ
আমার খুব গরম লাগছে,Mymensingh আমার মেলা গরম লাগতাসে,mɔʲenʃɔg ɐmɐɾ mɛlɐ gɔɾom lɐgt̪ɐʃe
তোমার  কি গরম লাগছে ?,Mymensingh তোমার কিতা গরম লাগতাসে?,mɔʲenʃɔn t̪omɐɾ kɪt̪ɐ gɔɾom lɐgt̪ɐʃe?
আপনার কি গরম লাগছে?,Mymensingh আফনের কি গরম লাগতাসে?,menʃɪn ɐpʰoneɾ kɪ gɔɾom lɐgt̪ɐʃe?
আপনি কি আমাকে ভালবাসেন?,Mymensingh আফনে কি আমারে ভালবাসেন?,menʃɪn ɐcʰone kɪ ɐmɐɾe bʱɐlbɐsen?
তোমার জন্য মনে আমার অফুরন্ত আশা,Mymensingh তোমার লাইজ্ঞা মনে আমার অফুরন্ত আশা,mɔʲenog t̪omɐɾ lɐ͡ɪ̯ggɐ mone ɐmɐɾ ɔpʰuɾont̪o ɐʃɐ
সারা জীবন পেতে চাই তোমার ভালবাসা ,Mymensingh সারা জীবন পাইতে চাই তোমার ভালবাসা ,mɔnoʃɪn ʃɐɾɐ ɟɪbɔn pɐ͡ɪ̯t̪e cɐ͡ɪ̯ t̪omɐɾ bʱɐlbɐʃɐ 
হারিয়ে যেতে ইচ্ছে করে অনেক দূরে,Mymensingh হারায়া যাইতে ইচ্ছা করে মেলা দূরে,menʃɪn hɐɾɐʲɐ ɟɐ͡ɪ̯t̪e ɪccʰɐ koɾe mɛlɐ d̪uɾe
চলোনা দুজনে মিলে ঘুরে আসি ,Mymensingh চলোনা দুইজনে মিল্লা ঘুইরা আসি,menʃɪnho cɔlonɐ d̪u͡ɪ̯ɟɔne mɪllɐ gʱu͡ɪ̯ɾɐ ɐʃɪ
"চলোনা দুজনে মিলে সাঁতার কাটি 
",Mymensingh চলোনা দুইজনে মিল্লা হাতার কাটি,menʃɪn cɔlonɐ d̪u͡ɪ̯ɟɔne mɪllɐ hɐt̪ɐɾ kɐtɪ
বাস্তব কঠিন হলেও মেনে নিয়ে মানিয়ে চলতে হয়,"Mymensingh বাস্তব কঠিন হইলেও মাইন্না নিয়া, মানায়া চলতে হয়","menʃɪn bɐst̪ob kotʰɪn ho͡ɪ̯le͡o̯ mɐ͡ɪ̯nnɐ nɪʲɐ, mɐnɐʲɐ cɔlt̪e hɔe̯"
ফেসবুকে তার একজনের সাথে সম্পর্ক হয়,Mymensingh ফেসবুকে তার একজনের সাথে সম্পর্ক হয়,menʃɪn pʰesbuke t̪ɐɾ ɛkɟoneɾ ʃɐt̪ʰe ʃɔmpoɾko hɔe̯
ছেলেটা ভালো চাকরি করে,Mymensingh ছেড়াডা ভালা চাকরি করে,menoʃɪn cʰeɽɐdɐ bʱɐlɐ cɐkɾɪ koɾe
এই পাঁচ মাসে ছেলে  তার পরিবার  নিয়ে মেয়ের বাসায় যায় না,Mymensingh এই পাঁচ মাসে ছেড়া হের পরিবার নিয়া মাইয়ার বাসায় যায় না,mɪmɪnʃ e͡ɪ̯ pɐ̃c mɐʃe cʰeɽɐ heɾ poɾɪbɐɾ nɪʲɐ mɐ͡ɪ̯ʲɐɾ bɐʃɐe̯ ɟɐe̯ nɐ
মেয়ে বলে প্রয়োজন পড়লে আমার পরিবার তোমার পরিবারের সাথে কথা বলবে,Mymensingh ছেড়ি কয় প্রয়োজন পড়লে আমার পরিবার তোমার পরিবারের সাথে কথা কইব,menʃɪnh cʰeɽɪ kɔe̯ pɾoʲoɟon pɔɽle ɐmɐɾ poɾɪbɐɾ t̪omɐɾ poɾɪbɐɾeɾ ʃɐt̪ʰe kɔt̪ʰɐ ko͡ɪ̯bo
পরিবার বলতে মা বাবা ভাই বোন নিয়ে,Mymensingh পরিবার কইতে মা বাপ ভাই বোন নিয়া,mɔʲenʃɪn poɾɪbɐɾ ko͡ɪ̯t̪e mɐ bɐp bʱɐ͡ɪ̯ bon nɪʲɐ
আমার স্বামী দুই বছর আগে আমাদেরকে রেখে এসে আলাদা হয়ে যায়,Mymensingh আমার স্বামী দুই বছর আগে আমাগোরে রাইক্ষা আইসা আলাদা হয়া যায়,mɪmɪng ɐmɐɾ ʃɐmɪ d̪u͡ɪ̯ bɔcʰoɾ ɐge ɐmɐgoɾe ɾɐ͡ɪ̯kkʰɐ ɐ͡ɪ̯ʃɐ ɐlɐd̪ɐ hɔʲɐ ɟɐe̯
আমার পছন্দ হয় এমন মেয়ে তাদের পছন্দ হয় না,Mymensingh আমার পসন্দ হয় এমন মাইয়া তারার পসন্দ হয় না,mɔʃɪng ɐmɐɾ pɔʃond̪o hɔe̯ ɛmon mɐ͡ɪ̯ʲɐ t̪ɐɾɐɾ pɔʃond̪o hɔe̯ nɐ
আপনার বাবা মার যেহেতু স্বপ্ন ,Mymensingh আফনের বাপ মার যেহেতু স্বপ্ন ,mɪmɪnʃ ɐpʰoneɾ bɐp mɐɾ ɟehet̪u ʃɔpno 
পরে আপনার অনেক আফসোস হবে  ,Mymensingh পরে আফনের অনেক আফসোস হইব,menʃɪnho pɔɾe ɐpʰoneɾ ɔnek ɐpʰsos ho͡ɪ̯bo
তাদের একটি বাচ্চা আছে পাঁচ বছরের,Mymensingh তাদের একটা বাচ্চা আসে পাঁচ বছরের, menoʃɔn t̪ɐd̪eɾ ɛktɐ bɐccɐ ɐʃe pɐ̃c bɔcʰoɾeɾ
দুজনেই তাদেরকে চাকরি নিয়ে ব্যস্ত,Mymensingh দুইজনেই তারার চাকরি নিয়া ব্যস্ত,menʃɪn d̪u͡ɪ̯ɟɔne͡ɪ̯ t̪ɐɾɐɾ cɐkɾɪ nɪʲɐ bɛst̪o
সংসারে কেউ ঠিকঠাকমতো সময় দিতে পারেনা,Mymensingh সংসারে কেউ ঠিকঠাকমতো সময় দিতে ফারেনা,mɔʲenʃɔn ʃɔŋʃɐɾe ke͡u̯ tʰɪktʰɐkmɔt̪o ʃɔmɔe̯ d̪ɪt̪e pʰɐɾenɐ
স্ত্রীর অভিযোগ স্বামী তার দায়িত্ব ঠিকমতো পালন করছে না,Mymensingh বউয়ের অভিযোগ জামাই তার দায়িত্ব ঠিকমতো পালন করতাসে না,menʃɪnh bo͡u̯ʲeɾ obʱɪɟog ɟɐmɐ͡ɪ̯ t̪ɐɾ d̪ɐʲɪt̪t̪o tʰɪkmɔt̪o pɐlon koɾt̪ɐʃe nɐ
আপনার নাম কি ?,Mymensingh আফনের নাম কি ?,menʃɪn ɐpʰoneɾ nɐm kɪ?
তোর নাম কি ?,Mymensingh তর নাম কি ?,menʃɪn t̪ɔɾ nɐm kɪ?
তোর গ্রামের বাড়ি কোঁথায় ?,Mymensingh তর গ্রামের বাড়ি কই?,mɔnoʃɪng t̪ɔɾ gɾɐmeɾ bɐɽɪ ko͡ɪ̯?
তোর বাবার নাম কি ?,Mymensingh তোর বাবার নাম কি ?,menʃɪn t̪oɾ bɐbɐɾ nɐm kɪ?
তোর মার নাম কি ?,Mymensingh তর মার নাম কিতা ?,menʃɪn t̪ɔɾ mɐɾ nɐm kɪt̪ɐ?
পরে খুঁজে নাও পেতে পারি,Mymensingh পরে খুঁইজ্জা নাও ফাইতে ফারি,mɔʃɪng pɔɾe kʰũɪɟɟɐ nɐ͡o̯ pʰɐ͡ɪ̯t̪e pʰɐɾɪ
তাদের সঙ্গে আমি সব সময় আনন্দে ভরে থাকি,Mymensingh তারার সাথে আমি বেগ সময় আনন্দে ভইরা থাকি,mɔnoʃɪn t̪ɐɾɐɾ ʃɐt̪ʰe ɐmɪ beg ʃɔmɔe̯ ɐnond̪e bʱo͡ɪ̯ɾɐ t̪ʰɐkɪ
আমার বন্ধুরা আমাকে ভালবাসা দেয়,Mymensingh আমার বন্ধুরা আমারে ভালবাসা দেয়,mɔʲenʃɔn ɐmɐɾ bond̪ʱuɾɐ ɐmɐɾe bʱɐlbɐʃɐ d̪ee̯
আমরা সবাই একসাথে হাসি খুশি করে সময় কাটাই,Mymensingh আমরা বেহেই একসাথে হাসি খুশি কইরা সময় কাডাই,mɪmɪnʃ ɐmɾɐ behe͡ɪ̯ ɛkʃɐt̪ʰe hɐʃɪ kʰuʃɪ ko͡ɪ̯ɾɐ ʃɔmɔe̯ kɐdɐ͡ɪ̯
আমাদের মধ্যে কোন রকম ঝগড়া নেই,Mymensingh আমরার মধ্যে কোন রহম ঝগড়া নাই,menoʃɔg ɐmɾɐɾ mod̪d̪ʱe kon ɾɔhɔm ɟʱɔgɽɐ nɐ͡ɪ̯
