bangla_speech,regional,regional_ipa,bangla_speech_ipa
তুমি কি সরকারি চাকরি করছো?, ময়মনসিংহঃ তুমি কিতা সরকারি চাকরি করতাসো?,menʃɪn t̪umɪ kɪt̪ɐ ʃɔɾkɐɾɪ cɐkɾɪ koɾt̪ɐʃo?,t̪umi ki s̪ɔrɔkari t͡ɕakri kɔrɔt͡ɕʰo?
আমি একজন সরকারি কর্মকর্তা, ময়মনসিংহঃ আমি একজন সরকারি কর্মকর্তা,mɔnoʃɔn ɐmɪ ɛkɟon ʃɔɾkɐɾɪ kɔɾmokɔɾt̪ɐ,ami ekɔd͡ʑɔn̪ɔ s̪ɔrɔkari kɔrmɔkɔrt̪a
তুমি কি চাকরি করছো?, ময়মনসিংহঃ তুমি কিতা চাকরি করসো?,menʃɪn t̪umɪ kɪt̪ɐ cɐkɾɪ kɔɾʃo?,t̪umi ki t͡ɕakri kɔrɔt͡ɕʰo?
আমি একজন প্রফেশনাল ব্লগার হয়ে কাজ করছি, ময়মনসিংহঃ আমি একজন প্রফেশনাল ব্লগার হয়া কাম করতাসি,menʃɔn ɐmɪ ɛkɟon pɾopʰeʃonɐl blɔgɐɾ hɔʲɐ kɐm koɾt̪ɐʃɪ,ami ekɔd͡ʑɔn̪ɔ prɔɸeɕn̪al̪ɔ bl̪ɔɡarɔ he̯e kad͡ʑɔ kɔrɔt͡ɕʰi
তুমি কোথায় চাকরি করছো?, ময়মনসিংহঃ তুমি কুনহানে চাকরি করতাসো?,menʃɪn t̪umɪ kunhɐne cɐkɾɪ koɾt̪ɐʃo?,t̪umi kot̪ʰae̯ɔ t͡ɕakri kɔrɔt͡ɕʰo?
দূরে কোথাও যেখানে কেউ নেই , ময়মনসিংহঃ দূরে কুনোখানে যেইহানে কেউ নাই ,menʃɪnh d̪uɾe kunokʰɐne ɟe͡ɪ̯hɐne ke͡u̯ nɐ͡ɪ̯ ,d̪ure kot̪ʰao d͡zekʰan̪e keu n̪ei 
আমি কেন সবসময় কষ্ট পাই?, ময়মনসিংহঃ আমি কেরে বেগসময় কষ্ট পাই?,mɔʲenʃɪnh ɐmɪ keɾe begʃɔmɔe̯ koʃto pɐ͡ɪ̯?,ami ken̪ɔ s̪ɔbɔs̪ɔme̯ɔ kɔʂtɔ pai?
তারা তিন ভাই ছিল কিন্তু তাদের মদ্ধে মিল ছিলো না, ময়মনসিংহঃ হেরা তিন ভাই আসিন কিন্তু তারার মদ্ধে মিল আসিন না,mɔʃɪn nɐ t̪ɪn bʱɐ͡ɪ̯ ɐʃɪn kɪnt̪u t̪ɐɾɐɾ mɔd̪d̪ʱe mɪl ɐʃɪn nɐ,t̪ara t̪in̪ɔ b̤ai t͡ɕʰil̪ɔ kin̪t̪u t̪ad̪erɔ mɔd̪d̪̤e mil̪ɔ t͡ɕʰil̪o n̪a
আপনি আমার সাথে এভাবে কথা বলতে পারেন না, ময়মনসিংহঃ আফনে আমার সাথে এম্নে কথা কইতে ফারেন না,menʃɪn ɐcʰone ɐmɐɾ ʃɐt̪ʰe emne kɔt̪ʰɐ ko͡ɪ̯t̪e pʰɐɾen nɐ,apn̪i amarɔ s̪at̪ʰe eb̤abe kɔt̪ʰa bɔl̪ɔt̪e paren̪ɔ n̪a
আপনি অনেক ভালো মানুষ , ময়মনসিংহঃ আফনে মেলা ভালা মানুষ,menoʃɔne mɛlɐ bʱɐlɐ mɐnuʃ,apn̪i on̪ekɔ b̤al̪o man̪uʂɔ 
আমরা ঢাকায় থাকি , ময়মনসিংহঃ আমরা ঢাকায় থাহি,menoʃɪn ɐmɾɐ dʱɐkɐe̯ t̪ʰɐhɪ,amra d̤akae̯ɔ t̪ʰaki 
আমি ঢাকার মিরপুরে থাকি , ময়মনসিংহঃ আমি ঢাকার মিরপুরে থাহি,mɔʲensɪn ɐmɪ dʱɐkɐɾ mɪɾpuɾe t̪ʰɐhɪ,ami d̤akarɔ mirpure t̪ʰaki 
আমি তার চোথের মায়ায় পড়েছি , ময়মনসিংহঃ আমি হের চোক্ষের মায়ায় পড়সি,mɔʲenʃɪn ɐmɪ heɾ cokkʰeɾ mɐʲɐe̯ pɔɽʃɪ,ami t̪arɔ t͡ɕot̪ʰerɔ mae̯ae̯ɔ pɔɽet͡ɕʰi 
তার হাসি অনেক সুন্দর, ময়মনসিংহঃ হের হাসি মেলা সুন্দর, mɔʲensɪng heɾ hɐʃɪ mɛlɐ ʃund̪ɔɾ,t̪arɔ has̪i on̪ekɔ s̪un̪d̪ɔrɔ
সে তার পরিবারকে ভালবাসে , ময়মনসিংহঃ হেয় হের পরিবাররে ভালবাসে,mɔʃensɪng hee̯ heɾ poɾɪbɐɾɾe bʱɐlbɐʃe,s̪e t̪arɔ pɔribarke b̤al̪bas̪e 
তার জন্য আমি সব কিছু করতে পারি , ময়মনসিংহঃ হের লাইজ্ঞা আমি বেগ কিসু করতাম ফারি, menʃɪn heɾ lɐ͡ɪ̯ggɐ ɐmɪ beg kɪʃu koɾt̪ɐm pʰɐɾɪ,t̪arɔ d͡ʑɔn̪d͡zɔ ami s̪ɔbɔ kit͡ɕʰu kɔrɔt̪e pari 
আমি তাকে ভালবাসি , ময়মনসিংহঃ আমি হেরে ভালবাসি,mɔnoʃɔn ɐmɪ heɾe bʱɐlbɐʃɪ,ami t̪ake b̤al̪bas̪i 
তার চুলগুলি অনেক লম্বা, ময়মনসিংহঃ হের চুলগুলা মেলা লম্বা,mɔʲensɪng heɾ culgulɐ mɛlɐ lɔmbɐ,t̪arɔ t͡ɕul̪ɡul̪i on̪ekɔ l̪ɔmba
তাকে কাজল দিলে অনেক ভালো লাগে, ময়মনসিংহঃ তারে কাজল দিলে মেলা ভালা লাগে,menʃɪn t̪ɐɾe kɐɟol d̪ɪle mɛlɐ bʱɐlɐ lɐge,t̪ake kad͡ʑɔl̪ɔ d̪il̪e on̪ekɔ b̤al̪o l̪aɡe
তুমি কি আমায় ভালোবাসো না? , ময়মনসিংহঃ তুমি কিতা আমারে ভালোবাস না?,menʃɪn t̪umɪ kɪt̪ɐ ɐmɐɾe bʱɐlobɐʃ nɐ?,t̪umi ki amae̯ɔ b̤al̪obas̪o n̪a? 
তুমি বুঝো না কেন ?, ময়মনসিংহঃ তুমি বুঝো না কেরে ?,mɔʲenʃɪn t̪umɪ buɟʱo nɐ keɾe?,t̪umi bud͡ʑ̤o n̪a ken̪ɔ ?
সে গান গাইতে পছন্দ করে , ময়মনসিংহঃ হেয় গান গাইতে পসন্দ করে,mɔʃensɪn hee̯ gɐn gɐ͡ɪ̯t̪e pɔʃond̪o koɾe,s̪e ɡan̪ɔ ɡait̪e pɔt͡ɕʰɔn̪d̪ɔ kɔre 
সে যেই মেয়েটিকে ভালবাসে ওই মেয়েটি ঢাকায় থাকে, ময়মনসিংহঃ হেয় যেই মাইয়াডারে ভালবাসে হেই মাইয়াডা ঢাকায় থাহে,mɔnoʃɪnh hee̯ ɟe͡ɪ̯ mɐ͡ɪ̯ʲɐdɐɾe bʱɐlbɐʃe he͡ɪ̯ mɐ͡ɪ̯ʲɐdɐ dʱɐkɐe̯ t̪ʰɐhe,s̪e d͡zei mee̯etike b̤al̪bas̪e oi mee̯eti d̤akae̯ɔ t̪ʰake
আপনি যেই ছেলেকে ভালবাসেন সেই ছেলেটি কি আপনাকে ভালবাসে ?, ময়মনসিংহঃ আফনে যেই ছেড়াডারে ভালবাসেন সেই ছেড়াডা কি আফনেরে ভালবাসে ?,mɪnʃɪn ɐcʰone ɟe͡ɪ̯ cʰeɽɐdɐɾe bʱɐlbɐʃen ʃe͡ɪ̯ cʰeɽɐdɐ kɪ ɐpʰoneɾe bʱɐlbɐʃe?,apn̪i d͡zei t͡ɕʰel̪eke b̤al̪bas̪en̪ɔ s̪ei t͡ɕʰel̪eti ki apn̪ake b̤al̪bas̪e ?
সে একটি গাড়ি চুরি করেছে, ময়মনসিংহঃ হেয় একটা গাড়ি চুরি করসে,mɔnoʃɪn hee̯ ɛktɐ gɐɽɪ cuɾɪ koɾʃe,s̪e ekti ɡaɽi t͡ɕuri kɔret͡ɕʰe
আমি তোমার সাথে পৃথিবী ঘুরে আসতে চাই , ময়মনসিংহঃ আমি তোমার লগে দুনিয়াডা ঘুইরা আসতাম চাই,menʃɔn ɐmɪ t̪omɐɾ lɔge d̪unɪʲɐdɐ gʱu͡ɪ̯ɾɐ ɐʃt̪ɐm cɐ͡ɪ̯,ami t̪omarɔ s̪at̪ʰe pɽit̪ʰibi ̤ɡ̤ure as̪t̪e t͡ɕai 
কিন্তু আমিতো তোমার সাথে যাবো না , ময়মনসিংহঃ কিন্তু আমিতো তোমার লগে যাইতাম না,menʃɪn kɪnt̪u ɐmɪt̪o t̪omɐɾ lɔge ɟɐ͡ɪ̯t̪ɐm nɐ,kin̪t̪u amit̪o t̪omarɔ s̪at̪ʰe d͡zabo n̪a 
তোমার কথা শুনে খুব ভালো লাগলো , ময়মনসিংহঃ তোমার কথা হুইন্না মেলা ভালা লাগল,mɔʲensɪng t̪omɐɾ kɔt̪ʰɐ hu͡ɪ̯nnɐ mɛlɐ bʱɐlɐ lɐgl,t̪omarɔ kɔt̪ʰa ɕun̪e kʰubɔ b̤al̪o l̪aɡl̪o 
তোমার ভালো না লাগলে কিছু করার নাই , ময়মনসিংহঃ তোমার ভালা না লাগলে কিসু করনের নাই,mɔʲensɪng t̪omɐɾ bʱɐlɐ nɐ lɐgle kɪʃu kɔɾoneɾ nɐ͡ɪ̯,t̪omarɔ b̤al̪o n̪a l̪aɡl̪e kit͡ɕʰu kɔrarɔ n̪ai 
ছবি তোলার পর আমাকে কেমন লাগে? , ময়মনসিংহঃ ছবি তুলনের পর আমারে কেমত লাগে?,mɔʲensɪn cʰobɪ t̪uloneɾ pɔɾ ɐmɐɾe kemɔt̪ lɐge?,t͡ɕʰɔbi t̪ol̪arɔ pɔrɔ amake kemɔn̪ɔ l̪aɡe? 
আমি আজকে অনেকদিন পর তার সাথে কথা বলেছি, ময়মনসিংহঃ আমি আজকে অনেকদিন পর হের সাথে কথা কইসি,mɔʲenʃɪn ɐmɪ ɐɟke ɔnekd̪ɪn pɔɾ heɾ ʃɐt̪ʰe kɔt̪ʰɐ ko͡ɪ̯ʃɪ,ami ad͡ʑke on̪ekd̪in̪ɔ pɔrɔ t̪arɔ s̪at̪ʰe kɔt̪ʰa bɔl̪et͡ɕʰi
সে দেখতে অনেক সুন্দর , ময়মনসিংহঃ হেয় দেখতে মেলা সুন্দর,mɔnoʃɪng hee̯ d̪ekʰt̪e mɛlɐ ʃund̪ɔɾ,s̪e d̪ekʰt̪e on̪ekɔ s̪un̪d̪ɔrɔ 
কিন্তু সৌন্দর্যই সবকিছু না, ময়মনসিংহঃ কিন্তু সৌন্দর্যই বেগকিনু না,menʃɪn kɪnt̪u ʃo͡u̯nd̪oɾɟo͡ɪ̯ begokɪnu nɐ,kin̪t̪u s̪own̪d̪ɔrd͡zi s̪ɔbɔkit͡ɕʰu n̪a
তার চোখ হরিণের মতো, ময়মনসিংহঃ হের চোখ হরিণের লাহান,mɔʲensɪng heɾ cox hoɾɪneɾ lɐhɐn,t̪arɔ t͡ɕokʰɔ hɔrinerɔ mɔt̪o
একটা মেয়ে আর একটা ছেলে একসাথে খেলছে, ময়মনসিংহঃ একটা ছেড়ি আর একটা ছেড়া একসাথে খেলতাসে,mɔʲenʃɪn ɛktɐ cʰeɽɪ ɐɾ ɛktɐ cʰeɽɐ ɛkʃɐt̪ʰe kʰelt̪ɐʃe,ekta mee̯e arɔ ekta t͡ɕʰel̪e eks̪at̪ʰe kʰel̪t͡ɕʰe
কালো কুকুরটা ঘাসের মধ্যে দিয়ে ছুটছে, ময়মনসিংহঃ কালা কুত্তাডা ঘাসের মধ্যে দিয়া ছুটতাসে,menʃɪng kɐlɐ kut̪t̪ɐdɐ gʱɐʃeɾ mod̪d̪ʱe d̪ɪʲɐ cʰutt̪ɐʃe,kal̪o kukurta ̤ɡ̤as̪erɔ mɔd̪̤d͡ze d̪ie̯e t͡ɕʰutt͡ɕʰe
একটা কালো কুকুর ঘাসের মধ্যে দৌড়াচ্ছে, ময়মনসিংহঃ একটা কালা কুত্তা ঘাসের মধ্যে দৌড়াইতাসে,menʃɪn ɛktɐ kɐlɐ kut̪t̪ɐ gʱɐʃeɾ mod̪d̪ʱe d̪o͡u̯ɽɐ͡ɪ̯t̪ɐʃe,ekta kal̪o kukurɔ ̤ɡ̤as̪erɔ mɔd̪̤d͡ze d̪owɽat͡ɕt͡ɕʰe
একটি ছোট কালো কুকুর ঘাসে মধ্যে শুয়ে আছে, ময়মনসিংহঃ একটা ছোড কালা কুত্তা ঘাসের মধ্যে শুয়া আসে,menʃɪn ɛktɐ cʰod kɐlɐ kut̪t̪ɐ gʱɐʃeɾ mod̪d̪ʱe ʃuʲɐ ɐʃe,ekti t͡ɕʰotɔ kal̪o kukurɔ ̤ɡ̤as̪e mɔd̪̤d͡ze ɕue̯e at͡ɕʰe
একদল মহিলা রাস্তায় হাঁটছে, ময়মনসিংহঃ একদল বেডি রাস্তায় হাঁটতাসে,menʃɪng ɛkd̪ɔl bedɪ ɾɐst̪ɐe̯ hɐ̃tt̪ɐʃe,ekɔd̪ɔl̪ɔ mɔhil̪a ras̪t̪ae̯ɔ hɔ̃tɔt͡ɕʰe
দরজার কাছে দুইজন বসে গিটার বাজাচ্ছে, ময়মনসিংহঃ দরজার কাসে দুইজন বয়া গিটার বাজাইতাসে,menʃɔn d̪ɔɾɟɐɾ kɐʃe d̪u͡ɪ̯ɟɔn bɔʲɐ gɪtɐɾ bɐɟɐ͡ɪ̯t̪ɐʃe,d̪ɔrɔd͡ʑarɔ kat͡ɕʰe d̪uid͡ʑɔn̪ɔ bɔs̪e ɡitarɔ bad͡ʑat͡ɕt͡ɕʰe
ফুটপাতে একসঙ্গে হাঁটছেন তিন মহিলা, ময়মনসিংহঃ ফুটপাতে একসাথে হাঁটতাসেন তিন বেডি,menʃɪn pʰutpɐt̪e ɛkʃɐt̪ʰe hɐ̃tt̪ɐʃen t̪ɪn bedɪ,ɸutpat̪e ekɔs̪ɔŋɡe hɔ̃tɔt͡ɕʰen̪ɔ t̪in̪ɔ mɔhil̪a
আম্মুর জন্য বেশি খারাপ লাগছে, ময়মনসিংহঃ আম্মার লাইজ্ঞা বেশি খারাপ লাগতাসে,menʃɔn ɐmmɐɾ lɐ͡ɪ̯ggɐ beʃɪ kʰɐɾɐp lɐgt̪ɐʃe,ammurɔ d͡ʑɔn̪d͡zɔ beɕi kʰarapɔ l̪aɡt͡ɕʰe
আমাদের পরিবারে আম্মুর অবদানই বেশি বলে আমি মনে করি, ময়মনসিংহঃ আমারার পরিবারে আম্মার অবদানই বেশি বইল্লা আমি মনে করি,mɔʲensɪn ɐmɐɾɐɾ poɾɪbɐɾe ɐmmɐɾ ɔbod̪ɐnɪ beʃɪ bo͡ɪ̯llɐ ɐmɪ mone koɾɪ,amad̪erɔ pɔribare ammurɔ obd̪an̪i beɕi bɔl̪e ami mɔn̪e kɔri
তোমাদের জন্য কিছু করতে তো পারলামই না উল্টো পরিবারকে শেষ করলাম, ময়মনসিংহঃ তোমরার লাইজ্ঞা কিসু করতাম তো ফারলামই না উলডা পরিবাররে শেষ করলাম,mɔʲenog t̪omɾɐɾ lɐ͡ɪ̯ggɐ kɪʃu koɾt̪ɐm t̪o pʰɐɾlɐmɪ nɐ uldɐ poɾɪbɐɾɾe ʃeʃ koɾlɐm,t̪omad̪erɔ d͡ʑɔn̪d͡zɔ kit͡ɕʰu kɔrɔt̪e t̪o parl̪ami n̪a ul̪to pɔribarke ɕeʂɔ kɔrɔl̪am
"সবসময় ভয়ে ভয়ে থাকতাম, গলা দিয়ে খাবার নামতো না"," ময়মনসিংহঃ বেগসময় ভয়ে ভয়ে থাকতাম, গলা দিয়া খাওন নামতো না","mɪmɪnʃ begʃɔmɔe̯ bʱɔʲe bʱɔʲe t̪ʰɐkt̪ɐm, gɔlɐ d̪ɪʲɐ kʰɐ͡o̯n nɐmt̪o nɐ","s̪ɔbɔs̪ɔme̯ɔ b̤e̯e b̤e̯e t̪ʰakt̪amɔ, ɡɔl̪a d̪ie̯e kʰabarɔ n̪amt̪o n̪a"
শেষ করলাম সবকিছু, ময়মনসিংহঃ শেষ করলাম বেগকিসু,mɔʲensɪng ʃeʃ koɾlɐm begokɪʃu,ɕeʂɔ kɔrɔl̪amɔ s̪ɔbɔkit͡ɕʰu
"যদিও ক্ষমার যোগ্য না আমি, পারলে ক্ষমা করে দিয়েন"," ময়মনসিংহঃ যদিও মাফের যোগ্য না আমি, পারলে মাফ কইরা দিয়েন","mɔʲenʃɪn ɟod̪ɪ͡o̯ mɐpʰeɾ ɟoggo nɐ ɐmɪ, pɐɾle mɐpʰ ko͡ɪ̯ɾɐ d̪ɪʲen","d͡zɔd̪io kʂɔmarɔ d͡zoɡɔd͡zɔ n̪a ami, parl̪e kʂɔma kɔre d̪ie̯en̪"
আপনাদের অযোগ্য সন্তান, ময়মনসিংহঃ আফনেরার অযোগ্য সন্তান,menʃɪn ɐpʰoneɾɐɾ ɔɟoggo ʃɔnt̪ɐn,apn̪ad̪erɔ od͡zoɡɔd͡zɔ s̪ɔn̪t̪an̪
আল্লাহ রহমতের বৃষ্টি দাও, ময়মনসিংহঃ আল্লাহ রহমতের বৃষ্টি দেও,menoʃɔg ɐllɐh ɾɔhɔmɔt̪eɾ bɾɪʃtɪ d̪e͡o̯,al̪l̪ahɔ rɔhɔmɔt̪erɔ bɽiʂti d̪ao
বৃষ্টির জন্য ঢাকায় কোথাও নামাজ পড়া হবে কি ?, ময়মনসিংহঃ বৃষ্টির লাইজ্ঞা ঢাকায় কুনোখানে নামাজ পড়ন হইব কি ?,menʃɪn bɾɪʃtɪɾ lɐ͡ɪ̯ggɐ dʱɐkɐe̯ kunokʰɐne nɐmɐɟ pɔɽon ho͡ɪ̯bo kɪ?,bɽiʂtirɔ d͡ʑɔn̪d͡zɔ d̤akae̯ɔ kot̪ʰao n̪amad͡ʑɔ pɔɽa hɔbe ki ?
পানির জন্য হাহাকার আর ভালো লাগছে না, ময়মনসিংহঃ পানির লাইজ্ঞা হাহাকার আর ভালা লাগতাসে না, mɔʃɪng pɐnɪɾ lɐ͡ɪ̯ggɐ hɐhɐkɐɾ ɐɾ bʱɐlɐ lɐgt̪ɐʃe nɐ,pan̪irɔ d͡ʑɔn̪d͡zɔ hahakarɔ arɔ b̤al̪o l̪aɡt͡ɕʰe n̪a
উত্তরাতে আমাদের ভবনে কোনোভাবেই পানি পাচ্ছি না আমরা, ময়মনসিংহঃ উত্তরাতে আমারার ভবনে কোনোমতেই পানি পাইতাসি না আমরা, menʃɪn ut̪t̪ɔɾɐt̪e ɐmɐɾɐɾ bʱɔbone konomɔt̪e͡ɪ̯ pɐnɪ pɐ͡ɪ̯t̪ɐʃɪ nɐ ɐmɾɐ,ut̪t̪ɔrat̪e amad̪erɔ b̤ɔbɔn̪e kon̪ob̤abei pan̪i pat͡ɕt͡ɕʰi n̪a amra
শুধু এক গাড়ি পানি হলেও ২টা দিন চলা যেতো, ময়মনসিংহঃ খালি এক গাড়ি পানি হইলেও ২ডা দিন চলন যাইত,mɔʲenosh kʰɐlɪ ɛk gɐɽɪ pɐnɪ ho͡ɪ̯le͡o̯ nɔdɐ d̪ɪn cɔlon ɟɐ͡ɪ̯t̪o,ɕud̪̤u ekɔ ɡaɽi pan̪i hɔl̪eo ২ta d̪in̪ɔ t͡ɕɔl̪a d͡zet̪o
কোনোভাবেই ওয়াসা পানি দিচ্ছে না, ময়মনসিংহঃ কোনমতেই ওয়াসা পানি দিতাসে না,mɔnoʃɪn konmɔt̪e͡ɪ̯ oʷɐʃɐ pɐnɪ d̪ɪt̪ɐʃe nɐ,kon̪ob̤abei oe̯as̪a pan̪i d̪it͡ɕt͡ɕʰe n̪a
কি করতে পারি বলুন এখন?, ময়মনসিংহঃ কিতা করতাম পারি কন এহন?,menʃɪn kɪt̪ɐ koɾt̪ɐm pɐɾɪ kon ehon?,ki kɔrɔt̪e pari bɔl̪un̪ɔ ekʰɔn̪ɔ?
বিদ্যুৎ ছাড়া না হয় থাকা যায় কিন্তু পানি ছাড়া কিভাবে থাকে মানুষ, ময়মনসিংহঃ বিদ্যুৎ ছাড়া না হয় থাকন যায় কিন্তু পানি ছাড়া কেমনে থাকে মানুষ,mɔʲenʃɪn bɪd̪d̪ut̪ cʰɐɽɐ nɐ hɔe̯ t̪ʰɐkon ɟɐe̯ kɪnt̪u pɐnɪ cʰɐɽɐ kɛmone t̪ʰɐke mɐnuʃ,bid̪d͡zut̪ɔ t͡ɕʰaɽa n̪a he̯ɔ t̪ʰaka d͡zae̯ɔ kin̪t̪u pan̪i t͡ɕʰaɽa kib̤abe t̪ʰake man̪uʂ
আজকে জুম্মার দিন , ময়মনসিংহঃ আইজকে জুম্মার দিন,menosɪn ɐ͡ɪ̯ɟke ɟummɐɾ d̪ɪn,ad͡ʑke d͡ʑummarɔ d̪in̪ɔ 
আমি শুক্রবার অনেক সকালে উঠি , ময়মনসিংহঃ আমি শুক্কুরবার মেলা সহালে উঠি,mɔʲensɪn ɐmɪ ʃukkuɾbɐɾ mɛlɐ ʃɔhɐle utʰɪ,ami ɕukrɔbarɔ on̪ekɔ s̪ɔkal̪e utʰi 
সে অনেক বেলা করে ঘুমায় , ময়মনসিংহঃ হেয় মেলা বেলা কইরা ঘুমায়,mɔʲenʃɪg hee̯ mɛlɐ belɐ ko͡ɪ̯ɾɐ gʱumɐe̯,s̪e on̪ekɔ bel̪a kɔre ̤ɡ̤umae̯ɔ 
সে আমাকে একটি উপহার দিয়েছে , ময়মনসিংহঃ হেয় আমারে একটা উপহার দিসে,mɪmɪns hee̯ ɐmɐɾe ɛktɐ upohɐɾ d̪ɪʃe,s̪e amake ekti upɔharɔ d̪ie̯et͡ɕʰe 
আমার বয়স বেশি না, ময়মনসিংহঃ আমার বয়স বেশি না,mɔʲensɪg ɐmɐɾ bɔʲoʃ beʃɪ nɐ,amarɔ be̯ɔs̪ɔ beɕi n̪a
তার চেয়ে আমি দেখতে সুন্দর , ময়মনসিংহঃ হের চেয়ে আমি দেখতে সুন্দর, mɔʲensɪn heɾ ceʲe ɐmɪ d̪ekʰt̪e ʃund̪ɔɾ,t̪arɔ t͡ɕee̯e ami d̪ekʰt̪e s̪un̪d̪ɔrɔ 
এইবার কুরবানিতে লাল গরু কিনবো , ময়মনসিংহঃ এইবার কুরবানিতে লাল গরু কিনবাম,menʃɔn e͡ɪ̯bɐɾ kuɾbɐnɪt̪e lɐl goɾu kɪnbɐm,eibarɔ kurban̪it̪e l̪al̪ɔ ɡɔru kin̪bo 
সবকিছু একসাথে করা সম্ভব না , ময়মনসিংহঃ বেগকিসু একসাথে করন সম্ভব না,menʃɪn begokɪʃu ɛkʃɐt̪ʰe kɔɾon ʃɔmbʱɔb nɐ,s̪ɔbɔkit͡ɕʰu eks̪at̪ʰe kɔra s̪ɔmb̤ɔbɔ n̪a 
তুমি বিয়ে করছো না কেন?, ময়মনসিংহঃ তুমি বিয়া করতাসো না কেরে?,mɪmɪnʃ t̪umɪ bɪʲɐ koɾt̪ɐʃo nɐ keɾe?,t̪umi bie̯e kɔrɔt͡ɕʰo n̪a ken̪ɔ?
ভালো মেয়ে পাচ্ছি না , ময়মনসিংহঃ ভালা মাইয়া পাইতাসি না ,menʃɪn bʱɐlɐ mɐ͡ɪ̯ʲɐ pɐ͡ɪ̯t̪ɐʃɪ nɐ ,b̤al̪o mee̯e pat͡ɕt͡ɕʰi n̪a 
ঘড়িতে কয়টা বাজে? , ময়মনসিংহঃ ঘড়িতে কয়টা বাজে?,menosɪng gʱoɽɪt̪e kɔʲtɐ bɐɟe?,̤ɡ̤ɔɽit̪e ke̯ɔta bad͡ʑe? 
আজকে দুপুরে আমাদের দাওয়াত আছে , ময়মনসিংহঃ আজকে দুফুরে আমরার দাওয়াত আসে,mɔʲensɪn ɐɟke d̪upʰuɾe ɐmɾɐɾ d̪ɐ͡o̯ʲɐt̪ ɐʃe,ad͡ʑke d̪upure amad̪erɔ d̪aoe̯at̪ɔ at͡ɕʰe 
সবাই কেমন আছো?, ময়মনসিংহঃ সবাই কেমত আসো?,menʃɪn ʃɔbɐ͡ɪ̯ kɛmɔt̪ ɐʃo?,s̪ɔbai kemɔn̪ɔ at͡ɕʰo?
আজকে কত তারিখ?, ময়মনসিংহঃ আইজকে কয় তারিখ?,menʃɪn ɐ͡ɪ̯ɟke kɔe̯ t̪ɐɾɪkʰ?,ad͡ʑke kɔt̪ɔ t̪arikʰɔ?
মন ভালো করতে তোমরা কি কর?, ময়মনসিংহঃ মন ভালা করতে তোমরা কিতা কর?,menʃɪn mon bʱɐlɐ koɾt̪e t̪omɾɐ kɪt̪ɐ kɔɾ?,mɔn̪ɔ b̤al̪o kɔrɔt̪e t̪omra ki kɔrɔ?
আমি মাঝেমধ্যে গান শুনি, ময়মনসিংহঃ আমি মাঝেমধ্যে গান হুনি,menosɪn ɐmɪ mɐɟʱemod̪d̪ʱe gɐn hunɪ,ami mad͡ʑ̤emɔd̪̤d͡ze ɡan̪ɔ ɕun̪i
আজকাল পড়াশোনার চাপ অনেক বেশি, ময়মনসিংহঃ আইজকাল পড়াশুনার চাপ অনেক বেশি,menʃɪn ɐ͡ɪ̯ɟkɐl pɔɽɐʃunɐɾ cɐp ɔnek beʃɪ,ad͡ʑkal̪ɔ pɔɽaɕon̪arɔ t͡ɕapɔ on̪ekɔ beɕi
তোমরা কি গল্পের বই পড়তে পছন্দ কর?, ময়মনসিংহঃ তোমরা কিতা গল্পের বই পড়তে পসন্দ কর?,mɔnoʃɪn t̪omɾɐ kɪt̪ɐ gɔlpeɾ bo͡ɪ̯ poɽt̪e pɔʃond̪o kɔɾ?,t̪omra ki ɡɔl̪perɔ bi pɔɽɔt̪e pɔt͡ɕʰɔn̪d̪ɔ kɔrɔ?
তোমাদের প্রিয় লেখক কে ?, ময়মনসিংহঃ তোমরার প্রিয় লেখক কেডা ?,menʃɪn t̪omɾɐɾ pɾɪʲo lekʰɔk kedɐ?,t̪omad̪erɔ prie̯ɔ l̪ekʰɔkɔ ke ?
আমার প্রিয় লেখক হুমায়ুন আহমেদ, ময়মনসিংহঃ আমার প্রিয় লেখক হুমায়ুন আহমেদ,menʃɪnho ɐmɐɾ pɾɪʲo lekʰɔk humɐʲun ɐhomed̪,amarɔ prie̯ɔ l̪ekʰɔkɔ humae̯un̪ɔ ahɔmed̪
ফুটবলে তোমাদের প্রিয় দল কোনটি?, ময়মনসিংহঃ ফুটবলে তোমরার প্রিয় দল কোনডা?,mɪmenʃɪn pʰutbɔle t̪omɾɐɾ pɾɪʲo d̪ɔl kondɐ?,ɸutɔbɔl̪e t̪omad̪erɔ prie̯ɔ d̪ɔl̪ɔ kon̪ti?
ব্রাজিল ফুটবলের সেরা দল, ময়মনসিংহঃ ব্রাজিল ফুটবলের সেরা দল,menʃɔn bɾɐɟɪl pʰutbɔleɾ ʃeɾɐ d̪ɔl,brad͡ʑil̪ɔ ɸutɔbɔl̪erɔ s̪era d̪ɔl̪ɔ
শুক্র এবং শনি সাপ্তাহিক ছুটির দিন, ময়মনসিংহঃ শুক্র আর শনি সাপ্তাহিক ছুটির দিন,menosɪn ʃukɾo ɐɾ ʃonɪ ʃɐpt̪ɐhɪk cʰutɪɾ d̪ɪn,ɕukrɔ ebɔŋ ɕɔn̪i s̪apt̪ahikɔ t͡ɕʰutirɔ d̪in̪
রবিবার থেকে আমাদের বিশ্ববিদ্যালয় ক্লাস শুরু, ময়মনসিংহঃ রবিবার থাইক্কা আমরার বিশ্ববিদ্যালয় ক্লাস শুরু,mɔʃɪn ɾobɪbɐɾ t̪ʰɐ͡ɪ̯kkɐ ɐmɾɐɾ bɪʃʃobɪd̪d̪ɐlɔe̯ klɐs ʃuɾu,rɔbibarɔ t̪ʰeke amad̪erɔ biɕbɔbid̪d͡zal̪e̯ɔ kl̪as̪ɔ ɕuru
তুমি ঢাকার কোথায় থাকো?, ময়মনসিংহঃ তুমি ঢাকার কুনহানে থাহো?,mɔʲensɪng t̪umɪ dʱɐkɐɾ kunhɐne t̪ʰɐho?,t̪umi d̤akarɔ kot̪ʰae̯ɔ t̪ʰako?
তোমাদের গ্রামের বাড়ি কোথায়?, ময়মনসিংহঃ তোমরার গ্রামের বাড়ি কুনহানে?,mɪnʃɔn t̪omɾɐɾ gɾɐmeɾ bɐɽɪ kunhɐne?,t̪omad̪erɔ ɡɔramerɔ baɽi kot̪ʰae̯ɔ?
তুমি কি সাঁতার জানো?, ময়মনসিংহঃ তুমি কিতা হাতার জানো?,menʃɪn t̪umɪ kɪt̪ɐ hɐt̪ɐɾ ɟɐno?,t̪umi ki s̪ɔ̃t̪arɔ d͡ʑan̪o?
তুমি কোন ক্লাসে পড়ো?, ময়মনসিংহঃ তুমি কোন ক্লাসে পড়ো?,mɔnoʃɪn t̪umɪ kon klɐse pɔɽo?,t̪umi kon̪ɔ kl̪as̪e pɔɽo?
