bangla_speech,regional,regional_ipa,bangla_speech_ipa
আমার আম্মুর সাথে ঝগড়া করে আমার ভাইয়ের বউ, ময়মনসিংহঃ আমার আম্মার লগে ঝগড়া কইরা আমার ভাইয়ের বউ,mɔʲensɪng ɐmɐɾ ɐmmɐɾ lɔge ɟʱɔgɽɐ ko͡ɪ̯ɾɐ ɐmɐɾ bʱɐ͡ɪ̯ʲeɾ bɔ͡u̯,amarɔ ammurɔ s̪at̪ʰe d͡ʑ̤ɔɡɔɽa kɔre amarɔ b̤aie̯erɔ bu
এই দুনিয়াতে আম্মু আব্বু ভাই ছাড়া আমার কেও নাই, ময়মনসিংহঃ এই দুনিয়াতে আম্মা আব্বা ভাই ছাড়া আমার কেও নাই,mɪmɪnʃɐt̪e ɐmmɐ ɐbbɐ bʱɐ͡ɪ̯ cʰɐɽɐ ɐmɐɾ ke͡o̯ nɐ͡ɪ̯,ei d̪un̪ie̯at̪e ammu abbu b̤ai t͡ɕʰaɽa amarɔ keo n̪ai
এই মেয়ে রীতিমতো আমার ভাই আর মাকে কষ্ট দিচ্ছে, ময়মনসিংহঃ এই মাইয়া রীতিমতো আমার ভাই আর মারে কষ্ট দিতাসে,mɔʲensɪn e͡ɪ̯ mɐ͡ɪ̯ʲɐ ɾɪt̪ɪmɔt̪o ɐmɐɾ bʱɐ͡ɪ̯ ɐɾ mɐɾe koʃto d̪ɪt̪ɐʃe,ei mee̯e rit̪imt̪o amarɔ b̤ai arɔ make kɔʂtɔ d̪it͡ɕt͡ɕʰe
আমার ভাই আম্মুকে ধরে শুধু কান্না করে, ময়মনসিংহঃ আমার ভাই আম্মারে ধইরা খালি কানদে ,mɔʲensɪn ɐmɐɾ bʱɐ͡ɪ̯ ɐmmɐɾe d̪ʱo͡ɪ̯ɾɐ kʰɐlɪ kɐnd̪e ,amarɔ b̤ai ammuke d̪̤ɔre ɕud̪̤u kan̪n̪a kɔre
মা কেন আমি এই জাগায় গেলাম, ময়মনসিংহঃ আম্মা কেন আমি এই জাগায় গেলাম,mɔʲensɪn ɐmmɐ keno ɐmɪ e͡ɪ̯ ɟɐgɐe̯ gelɐm,ma ken̪ɔ ami ei d͡ʑaɡae̯ɔ ɡel̪am
মেয়ের মা আমার আম্মুকে বলছিল যে আপনাদের টিনের ঘড় দেখে বিয়ে দিছি, ময়মনসিংহঃ মাইয়ার মা আমার আম্মারে কইসিল যে আফনেরার টিনের ঘড় দেইক্ষা বিয়া দিসি, mɪnʃɪn mɐ͡ɪ̯ʲɐɾ mɐ ɐmɐɾ ɐmmɐɾe ko͡ɪ̯sɪlo ɟe ɐpʰoneɾɐɾ tɪneɾ gʱɔɽ d̪e͡ɪ̯kkʰɐ bɪʲɐ d̪,mee̯erɔ ma amarɔ ammuke bɔl̪ɔt͡ɕʰil̪ɔ d͡ze apn̪ad̪erɔ tin̪erɔ ̤ɡ̤ɔɽɔ d̪ekʰe bie̯e d̪it͡ɕʰi
এখন এটার সমাধান কোথায় পাবো, ময়মনসিংহঃ এহন এইডার সমাধান কোনখানে পায়াম,mɪmɪnʃ ehon e͡ɪ̯dɐɾ ʃɔmɐd̪ʱɐn konkʰɐne pɐʲɐm,ekʰɔn̪ɔ etarɔ s̪ɔmad̪̤an̪ɔ kot̪ʰae̯ɔ pabo
আমার স্বামী হাসপাতাল এসেছে আমার বাবাকে দেখতে নয় আমাকে নিতে, ময়মনসিংহঃ আমার জামাই হাসপাতাল আইসে আমার আব্বারে দেখতে না আমারে নিতে,mɪmɪng ɐmɐɾ ɟɐmɐ͡ɪ̯ hɐʃpɐt̪ɐl ɐ͡ɪ̯ʃe ɐmɐɾ ɐbbɐɾe d̪ekʰt̪e nɐ ɐmɐɾe nɪt̪e,amarɔ s̪bami has̪pat̪al̪ɔ es̪et͡ɕʰe amarɔ babake d̪ekʰt̪e n̪e̯ɔ amake n̪it̪e
হাসপাতালে এসেই আমাকে বলে চলো বাসায় যাই, ময়মনসিংহঃ হাসপাতালে আয়াই আমারে কয় চল বাসায় যাই,mɔʲensɪn hɐʃpɐt̪ɐle ɐʲɐ͡ɪ̯ ɐmɐɾe kɔe̯ cɔl bɐʃɐe̯ ɟɐ͡ɪ̯,has̪pat̪al̪e es̪ei amake bɔl̪e t͡ɕɔl̪o bas̪ae̯ɔ d͡zai
কালকে আমাদের বাসায় মেহমান আসবে, ময়মনসিংহঃ কালকে আমরার বাসায় মেমান আইব,mɔʲensɪn kɐloke ɐmɾɐɾ bɐʃɐe̯ memɐn ɐ͡ɪ̯bo,kal̪ke amad̪erɔ bas̪ae̯ɔ mehɔman̪ɔ as̪be
মানুষের বিবেকবুদ্ধি কতটা খারাপ হতে পারে, ময়মনসিংহঃ মানুষের বিবেকবুদ্ধি কতডা খারাপ হইতে পারে,menʃɪn mɐnuʃeɾ bɪbekbud̪d̪ʱɪ kɔt̪odɐ kʰɐɾɐp ho͡ɪ̯t̪e pɐɾe,man̪uʂerɔ bibekbud̪d̪̤i kɔt̪ɔta kʰarapɔ hɔt̪e pare
আমার বাবা অসুস্থ হাসপাতালে আর সে এসেছে আমাকে নিতে, ময়মনসিংহঃ আমার আব্বা অসুস্থ হাসপাতালে আর হেয় আইসে আমারে নিতে,mɪmɪng ɐmɐɾ ɐbbɐ ɔʃust̪ʰo hɐʃpɐt̪ɐle ɐɾ hee̯ ɐ͡ɪ̯ʃe ɐmɐɾe nɪt̪e,amarɔ baba os̪us̪t̪ʰɔ has̪pat̪al̪e arɔ s̪e es̪et͡ɕʰe amake n̪it̪e
আমি ওকে বলে দিয়েছি আমি আর তোমার সাথে সংসার করবো না, ময়মনসিংহঃ আমি ওরে কয়া দিসি আমি আর তোমার লগে সংসার করতাম না,mɔʲɐ d̪ɪʃɪ ɐmɪ ɐɾ t̪omɐɾ lɔge ʃɔŋʃɐɾ koɾt̪ɐm nɐ,ami oke bɔl̪e d̪ie̯et͡ɕʰi ami arɔ t̪omarɔ s̪at̪ʰe s̪ɔŋs̪arɔ kɔrɔbo n̪a
তোমার সংসারের প্রয়োজন মেটানোর জন্য আমার জন্ম হয়নি, ময়মনসিংহঃ তোমার সংসারের প্রয়োজন মিটানোর লাইজ্ঞা আমার জন্ম হয় নাই,menʃɪn t̪omɐɾ ʃɔŋʃɐɾeɾ pɾoʲoɟon mɪtɐnoɾ lɐ͡ɪ̯ggɐ ɐmɐɾ ɟɔnmo hɔe̯ nɐ͡ɪ̯,t̪omarɔ s̪ɔŋs̪arerɔ pre̯od͡ʑɔn̪ɔ metan̪orɔ d͡ʑɔn̪d͡zɔ amarɔ d͡ʑɔn̪mɔ he̯ɔn̪i
আমার বাবার প্রতি আমার কিছু দায়িত্ববোধ আছে, ময়মনসিংহঃ আমার বাপের প্রতি আমার কিসু দায়িত্ববোধ আসে,menʃɪn ɐmɐɾ bɐpeɾ pɾot̪ɪ ɐmɐɾ kɪʃu d̪ɐʲɪt̪t̪obod̪ʱ ɐʃe,amarɔ babarɔ prɔt̪i amarɔ kit͡ɕʰu d̪ae̯it̪bɔbod̪̤ɔ at͡ɕʰe
অনেক তোমার সংসারে দায়িত্ব পালন করেছি, ময়মনসিংহঃ অনেক তোমার সংসারে দায়িত্ব পালন করসি,menʃɪn ɔnek t̪omɐɾ ʃɔŋʃɐɾe d̪ɐʲɪt̪t̪o pɐlon koɾʃɪ,on̪ekɔ t̪omarɔ s̪ɔŋs̪are d̪ae̯it̪bɔ pal̪ɔn̪ɔ kɔret͡ɕʰi
এখন আমি আমার বাবা দায়িত্ব পালন করব, ময়মনসিংহঃ এহন আমি আমার বাপের দায়িত্ব পালন করবাম,mɔʲenʃɔn ehon ɐmɪ ɐmɐɾ bɐpeɾ d̪ɐʲɪt̪t̪o pɐlon koɾbɐm,ekʰɔn̪ɔ ami amarɔ baba d̪ae̯it̪bɔ pal̪ɔn̪ɔ kɔrɔbɔ
আমার স্বামী আমার কথা শুনে রাগে হাসপাতাল থেকে বের হয়ে গেছে, ময়মনসিংহঃ আমার জামাই আমার কথা হুইন্না রাগে হাসপাতাল থাইক্কা বাইর হয়া গেসে,mɪnʃɔn ɐmɐɾ ɟɐmɐ͡ɪ̯ ɐmɐɾ kɔt̪ʰɐ hu͡ɪ̯nnɐ ɾɐge hɐʃpɐt̪ɐl t̪ʰɐ͡ɪ̯kkɐ bɐ͡ɪ̯ɾ hɔʲɐ ges,amarɔ s̪bami amarɔ kɔt̪ʰa ɕun̪e raɡe has̪pat̪al̪ɔ t̪ʰeke berɔ he̯e ɡet͡ɕʰe
আমার একটুও কষ্ট হচ্ছে না, ময়মনসিংহঃ আমার একটুও কষ্ট হইতাসে না,mɔʲensɪn ɐmɐɾ ektu͡o̯ koʃto ho͡ɪ̯t̪ɐʃe nɐ,amarɔ ektuo kɔʂtɔ hɔt͡ɕt͡ɕʰe n̪a
দয়া করে পরিচয় গোপন রাখবেন, ময়মনসিংহঃ দয়া কইরা পরিচয় গোপন রাখবাইন,mɔʲɐ ko͡ɪ̯ɾɐ poɾɪcɔe̯ gopon ɾɐkʰbɐ͡ɪ̯n,d̪e̯a kɔre pɔrit͡ɕe̯ɔ ɡopɔn̪ɔ rakʰben̪
আমি জানি না কীভাবে শুরু করবো, ময়মনসিংহঃ আমি জানি না কেমনে শুরু করবাম,mɔʲensɪn ɐmɪ ɟɐnɪ nɐ kɛmone ʃuɾu koɾbɐm,ami d͡ʑan̪i n̪a kib̤abe ɕuru kɔrɔbo
কখনো ভাবিও নাই আমার এখানে পোস্ট করে সাহায্য চাইতে হবে, ময়মনসিংহঃ কহনো ভাবিও নাই আমার এহানে পোস্ট কইরা সাহায্য চাইতে হইব,mɛnʃɪnh kɔhono bʱɐbɪ͡o̯ nɐ͡ɪ̯ ɐmɐɾ ehɐne post ko͡ɪ̯ɾɐ ʃɐhɐɟɟo cɐ͡ɪ̯t̪e ho͡ɪ̯bo,kɔkʰɔn̪o b̤abio n̪ai amarɔ ekʰan̪e pos̪tɔ kɔre s̪ahad͡zd͡zɔ t͡ɕait̪e hɔbe
আমি নিজেই অনেক জনকে উপদেশ দিয়েছি, ময়মনসিংহঃ আমি নিজেই অনেক জনরে উপদেশ দিসি,mɔʲenʃɔn ɐmɪ nɪɟe͡ɪ̯ ɔnek ɟɔnoɾe upod̪eʃ d̪ɪʃɪ,ami n̪id͡ʑei on̪ekɔ d͡ʑɔn̪ɔke upd̪eɕɔ d̪ie̯et͡ɕʰi
এখন নিজেই আর পারছি না, ময়মনসিংহঃ এহন নিজেই আর পারতাসি না,mɔʲensɪn ehon nɪɟe͡ɪ̯ ɐɾ pɐɾt̪ɐʃɪ nɐ,ekʰɔn̪ɔ n̪id͡ʑei arɔ part͡ɕʰi n̪a
যাইহোক আসল কথায় আসি, ময়মনসিংহঃ যাইহোক আসল কথায় আই,mɔnoʃɪn ɟɐ͡ɪ̯hok ɐʃol kɔt̪ʰɐe̯ ɐ͡ɪ̯,d͡zaihokɔ as̪ɔl̪ɔ kɔt̪ʰae̯ɔ as̪i
আমার বিয়ে হয়েছে দেড় বছর, ময়মনসিংহঃ আমার বিয়া হইসে দেড় বছর,mɔʲenʃɔn ɐmɐɾ bɪʲɐ ho͡ɪ̯ʃe d̪eɽ bɔcʰoɾ,amarɔ bie̯e he̯et͡ɕʰe d̪eɽɔ bɔt͡ɕʰɔrɔ
বলে রাখা ভালো এইটা আমার এবং আমার স্বামীর ২ জনেরই দ্বিতীয় সংসার, ময়মনসিংহঃ কয়া রাহা ভালা এইডা আমার আর আমার জামাইয়ের ২ জনেরই দ্বিতীয় সংসার,mɔʲɐ ɾɐhɐ bʱɐlɐ e͡ɪ̯dɐ ɐmɐɾ ɐɾ ɐmɐɾ ɟɐmɐ͡ɪ̯ʲeɾ nɔ ɟɔneɾɪ d̪ɪt̪ɪʲo ʃɔŋʃɐɾ,bɔl̪e rakʰa b̤al̪o eita amarɔ ebɔŋ amarɔ s̪bamirɔ ২ d͡ʑɔn̪eri d̪bit̪ie̯ɔ s̪ɔŋs̪ar
"আমার বাবা,ভাই,বোন কেউ নেই"," ময়মনসিংহঃ আমার বাপ,ভাই,বোন কেউ নাই"," mɔʲensɪn ɐmɐɾ,bʱɐ͡ɪ̯,bon ke͡u̯ nɐ͡ɪ̯","amarɔ baba,b̤ai,bon̪ɔ keu n̪ei"
আমার বিয়ের ২ মাসের মাথায় আব্বু মারা গেছেন, ময়মনসিংহঃ আমার বিয়ার ২ মাসের মাথায় আব্বা মারা গেসেন,mɔʲensɪn ɐmɐɾ bɪʲɐɾ nɔ mɐʃeɾ mɐt̪ʰɐe̯ ɐbbɐ mɐɾɐ gesen,amarɔ bie̯erɔ ২ mas̪erɔ mat̪ʰae̯ɔ abbu mara ɡet͡ɕʰen̪
আমার শুধু আম্মু আছেন, ময়মনসিংহঃ আমার শুধু আম্মা আসেন,mɔʲensɪn ɐmɐɾ ʃud̪ʱu ɐmmɐ ɐʃen,amarɔ ɕud̪̤u ammu at͡ɕʰen̪
প্রথমে আমার স্বামীর কথায় আসি, ময়মনসিংহঃ প্রথমে আমার জামাইয়ের কথায় আই,menoʃɪn pɾot̪ʰome ɐmɐɾ ɟɐmɐ͡ɪ̯ʲeɾ kɔt̪ʰɐe̯ ɐ͡ɪ̯,prɔt̪ʰɔme amarɔ s̪bamirɔ kɔt̪ʰae̯ɔ as̪i
আলহামদুলিল্লাহ সে খুব ভালো একজন মানুষ, ময়মনসিংহঃ আলহামদুলিল্লাহ হেয় খুব ভালা একজন মানুষ,mɪnʃɔn ɐlhɐmd̪ulɪllɐh hee̯ kʰub bʱɐlɐ ɛkɟon mɐnuʃ,al̪ɔhamd̪ul̪il̪l̪ahɔ s̪e kʰubɔ b̤al̪o ekɔd͡ʑɔn̪ɔ man̪uʂ
স্বামী হিসেবে একদম নিখুঁত, ময়মনসিংহঃ জামাই হিসাবে একদম নিখুঁত,menʃɪn ɟɐmɐ͡ɪ̯ hɪʃɐbe ɛkd̪ɔm nɪkʰũt̪,s̪bami his̪ebe ekɔd̪ɔmɔ n̪ikʰuঁt̪ɔ
তাকে নিয়ে আমার অভিযোগ এর কোন জায়গা নেই, ময়মনসিংহঃ তারে নিয়া আমার অভিযোগ এর কোন জায়গা নাই,mɔʲensɪn t̪ɐɾe nɪʲɐ ɐmɐɾ obʱɪɟog eɾ kon ɟɐʲgɐ nɐ͡ɪ̯,t̪ake n̪ie̯e amarɔ ob̤id͡zoɡɔ erɔ kon̪ɔ d͡ʑae̯ɡa n̪ei
সমস্যা টা হচ্ছে কয়েক মাস আগে থেকে আমার শাশুড়ী মাকে নিয়ে, ময়মনসিংহঃ সমস্যা টা হইতাসে কয়েক মাস আগে থাইক্কা আমার শাশুড়ী মারে নিয়া,mɔʲenʃɔn ʃɔmoʃʃɐ tɐ ho͡ɪ̯t̪ɐʃe kɔʲek mɐʃ ɐge t̪ʰɐ͡ɪ̯kkɐ ɐmɐɾ ʃɐʃuɽɪ mɐɾe nɪʲɐ,s̪ɔmɔs̪d͡za ta hɔt͡ɕt͡ɕʰe ke̯ekɔ mas̪ɔ aɡe t̪ʰeke amarɔ ɕaɕuɽi make n̪ie̯e
আমি খেয়াল করছি উনি আর উনার ছেলের সম্পর্ক খুব খারাপ, ময়মনসিংহঃ আমি খেয়াল করসি হেয় আর হের পোলার সম্পর্ক খুব খারাপ,mɔʲenʃɔn ɐmɪ kʰeʲɐl koɾʃɪ hee̯ ɐɾ heɾ polɐɾ ʃɔmpoɾko kʰub kʰɐɾɐp,ami kʰee̯al̪ɔ kɔrɔt͡ɕʰi un̪i arɔ un̪arɔ t͡ɕʰel̪erɔ s̪ɔmpɔrkɔ kʰubɔ kʰarap
"আমার স্বামীর একটা সমস্যা আছে ,ও একটু চিল্লায় কথা বলে"," ময়মনসিংহঃ আমার জামাইয়ের একটা সমস্যা আসে ,ওয় একটু চিল্লায় কথা কয়","mɪmoʃʃɐmɐɾ ɟɐmɐ͡ɪ̯ʲeɾ ɛktɐ ʃɔmoʃʃɐ ɐʃe,oe̯ ektu cɪllɐe̯ kɔt̪ʰɐ kɔe̯","amarɔ s̪bamirɔ ekta s̪ɔmɔs̪d͡za at͡ɕʰe ,o ektu t͡ɕil̪l̪ae̯ɔ kɔt̪ʰa bɔl̪e"
আমি দেখেছি সব সময় এমন কাজ করেন যার জন্য উনার ছেলে অনেক রাগ করেন, ময়মনসিংহঃ আমি দেখসি বেগ সময় এমন কাম করেন যার লাইজ্ঞা হের পোলা মেলা রাগ করে, mɔe̯ʃɪ beg ʃɔmɔe̯ ɛmon kɐm kɔɾen ɟɐɾ lɐ͡ɪ̯ggɐ heɾ polɐ mɛlɐ ɾɐg koɾe,ami d̪ekʰet͡ɕʰi s̪ɔbɔ s̪ɔme̯ɔ emɔn̪ɔ kad͡ʑɔ kɔren̪ɔ d͡zarɔ d͡ʑɔn̪d͡zɔ un̪arɔ t͡ɕʰel̪e on̪ekɔ raɡɔ kɔren̪
কিছু বললে উনি সেইটা অন্যভাবে নিয়ে চিল্লাচিল্লি করেন, ময়মনসিংহঃ কিসু কইলে হেয় ওইডা অন্যভাবে নিয়া চিল্লাচিল্লি করে,mɔʃenogho kɪʃu ko͡ɪ̯le hee̯ o͡ɪ̯dɐ ɔnnobʱɐbe nɪʲɐ cɪllɐcɪllɪ koɾe,kit͡ɕʰu bɔl̪ɔl̪e un̪i s̪eita on̪d͡zɔb̤abe n̪ie̯e t͡ɕil̪l̪at͡ɕil̪l̪i kɔren̪
উনি যেইটা বলবে সেইটাই ঠিক আর সেইটাই করবে, ময়মনসিংহঃ উনি যেইডা কইব ওইডাই ঠিক আর ওইডাই করব,menʃɪn unɪ ɟe͡ɪ̯dɐ ko͡ɪ̯bo o͡ɪ̯dɐ͡ɪ̯ tʰɪk ɐɾ o͡ɪ̯dɐ͡ɪ̯ koɾbo,un̪i d͡zeita bɔl̪ɔbe s̪eitai tʰikɔ arɔ s̪eitai kɔrɔbe
কারো কথা উনি শুনেন না, ময়মনসিংহঃ কারো কথা হেয় হুনে না,mɔʲenʃɪn kɐɾo kɔt̪ʰɐ hee̯ hune nɐ,karo kɔt̪ʰa un̪i ɕun̪en̪ɔ n̪a
উনার কারো সাথে ভালো সম্পর্ক নেই, ময়মনসিংহঃ হের কারো লগে ভালা সম্পর্ক নাই,menʃɪnho heɾ kɐɾo lɔge bʱɐlɐ ʃɔmpoɾko nɐ͡ɪ̯,un̪arɔ karo s̪at̪ʰe b̤al̪o s̪ɔmpɔrkɔ n̪ei
আমার স্বামীর সবকিছুতে উনি দোষ দেখেন, ময়মনসিংহঃ আমার জামাইয়ের বেগকিসুতে হেয় দোষ দেহে,mɪmɪng ɐmɐɾ ɟɐmɐ͡ɪ̯ʲeɾ begokɪʃut̪e hee̯ d̪oʃ d̪ehe,amarɔ s̪bamirɔ s̪ɔbɔkit͡ɕʰut̪e un̪i d̪oʂɔ d̪ekʰen̪
সবাইকে বলেন ইদানীং আমার ছেলে বদলে গেছে, ময়মনসিংহঃ সবাইরে কয় ইদানীং আমার পোলা বদলায়া গেসে,menʃɪn ʃɔbɐ͡ɪ̯ɾe kɔe̯ ɪd̪ɐnɪŋ ɐmɐɾ polɐ bɔd̪lɐʲɐ gese,s̪ɔbaike bɔl̪en̪ɔ id̪an̪iŋ amarɔ t͡ɕʰel̪e bɔd̪ɔl̪e ɡet͡ɕʰe
গতকাল একটা ছোট বিষয় নিয়ে বলেন বিয়ের পর ছেলেরা কেমন বদলে যায়, ময়মনসিংহঃ গতকাল একটা ছোট বিষয় নিয়া কইলেন বিয়ার পরে পোলারা কেমন বদলায়া যায়,menʃɪnh gɔt̪okɐl ɛktɐ cʰoto bɪʃɔe̯ nɪʲɐ ko͡ɪ̯len bɪʲɐɾ pɔɾe polɐɾɐ kɛmon bɔd̪lɐʲɐ ɟɐe̯,ɡɔt̪ɔkal̪ɔ ekta t͡ɕʰotɔ biʂe̯ɔ n̪ie̯e bɔl̪en̪ɔ bie̯erɔ pɔrɔ t͡ɕʰel̪era kemɔn̪ɔ bɔd̪ɔl̪e d͡zae̯
উনাদের মা ছেলের সম্পর্ক খারাপ এর প্রভাব আমার উপর আসে, ময়মনসিংহঃ হেরার মা পোলার সম্পর্ক খারাপ এর প্রভাব আমার উপর আয়,menʃɪnho heɾɐɾ mɐ polɐɾ ʃɔmpoɾko kʰɐɾɐp eɾ pɾobʱɐb ɐmɐɾ upoɾ ɐe̯,un̪ad̪erɔ ma t͡ɕʰel̪erɔ s̪ɔmpɔrkɔ kʰarapɔ erɔ prɔb̤abɔ amarɔ upɔrɔ as̪e
আমি আমার স্বামীর সাথে রাগ করি কেনো তাদের এরকম কথা কাটাকাটি হয়, ময়মনসিংহঃ আমি আমার জামাইয়ের লগে রাগ করি কেরে তারার এরকম কথা কাটাকাটি হয়,mɔʲensɪn ɐmɪ ɐmɐɾ ɟɐmɐ͡ɪ̯ʲeɾ lɔge ɾɐg koɾɪ keɾe t̪ɐɾɐɾ eɾokom kɔt̪ʰɐ kɐtɐkɐtɪ hɔe̯,ami amarɔ s̪bamirɔ s̪at̪ʰe raɡɔ kɔri ken̪o t̪ad̪erɔ erɔkɔmɔ kɔt̪ʰa katakati he̯ɔ
ও আমাকে কোন কাজে সাহায্য করে, ময়মনসিংহঃ ও আমারে কোন কামে সাহায্য করে,mɔnoʃɪn o ɐmɐɾe kon kɐme ʃɐhɐɟɟo koɾe,o amake kon̪ɔ kad͡ʑe s̪ahad͡zd͡zɔ kɔre
"কিছু কিনে দিতে চাইলে,কোথায় ঘুরতে নিয়ে যেতে চাইলে উনি সেইটা ভালোভাবে নেন না"," ময়মনসিংহঃ কিসু কিন্না দিতে চাইলে,কোথায় ঘুরতে নিয়া যাইতে চাইলে হেয় হেইডা ভালোভাবে লন না","mɔnoʃɪn kɪʃu kɪnnɐ d̪ɪt̪e cɐ͡ɪ̯le,kot̪ʰɐe̯ gʱuɾt̪e nɪʲɐ ɟɐ͡ɪ̯t̪e cɐ͡ɪ̯le hee̯ he͡ɪ̯dɐ b","kit͡ɕʰu kin̪e d̪it̪e t͡ɕail̪e,kot̪ʰae̯ɔ ̤ɡ̤urt̪e n̪ie̯e d͡zet̪e t͡ɕail̪e un̪i s̪eita b̤al̪ob̤abe n̪en̪ɔ n̪a"
আমাদের আর উনাদের সময় তো এক না, ময়মনসিংহঃ আমরার আর হেরার সময় তো এক না,mɔʲensɪg ɐmɾɐɾ ɐɾ heɾɐɾ ʃɔmɔe̯ t̪o ɛk nɐ,amad̪erɔ arɔ un̪ad̪erɔ s̪ɔme̯ɔ t̪o ekɔ n̪a
আমার বাসার কেউ আসলে উনি বাসায় ঝগড়াঝাটি শুরু করে দেন, ময়মনসিংহঃ আমার বাসার কেউ আইলে উনি বাসায় ঝগড়াঝাটি শুরু কইরা দেন,mɪmɪnʃ ɐmɐɾ bɐʃɐɾ ke͡u̯ ɐ͡ɪ̯le unɪ bɐʃɐe̯ ɟʱɔgɽɐɟʱɐtɪ ʃuɾu ko͡ɪ̯ɾɐ d̪ɛn,amarɔ bas̪arɔ keu as̪l̪e un̪i bas̪ae̯ɔ d͡ʑ̤ɔɡɔɽad͡ʑ̤ati ɕuru kɔre d̪en̪
আমার স্বামী বাসায় কিছু আনলে সবার জন্য নিয়ে আসেন, ময়মনসিংহঃ আমার জামাই বাসায় কিসু আনলে সবার লাইজ্ঞা নিয়া আসেন,mɔʲenog ɐmɐɾ ɟɐmɐ͡ɪ̯ bɐʃɐe̯ kɪʃu ɐnole ʃɔbɐɾ lɐ͡ɪ̯ggɐ nɪʲɐ ɐʃen,amarɔ s̪bami bas̪ae̯ɔ kit͡ɕʰu an̪l̪e s̪ɔbarɔ d͡ʑɔn̪d͡zɔ n̪ie̯e as̪en̪
তাও মার অভিযোগ ও কিছু আনে না, ময়মনসিংহঃ তাও আম্মার অভিযোগ হেয় কিসু আনে না,mɔʲensɪn t̪ɐ͡o̯ ɐmmɐɾ obʱɪɟog hee̯ kɪʃu ɐne nɐ,t̪ao marɔ ob̤id͡zoɡɔ o kit͡ɕʰu an̪e n̪a
কিন্তু আমি নিজেই দেখেছি ও মাকে কত ভালোবাসে, ময়মনসিংহঃ কিন্তু আমি নিজেই দেখসি ওয় মারে কত ভালবাসে,menʃɪnho kɪnt̪u ɐmɪ nɪɟe͡ɪ̯ d̪ekʰʃɪ oe̯ mɐɾe kɔt̪o bʱɐlbɐʃe,kin̪t̪u ami n̪id͡ʑei d̪ekʰet͡ɕʰi o make kɔt̪ɔ b̤al̪obas̪e
এইটা ওইটা কিনে দিতে চাইলে বলে টাকা নষ্ট করিস না, ময়মনসিংহঃ এইডা ওইডা কিন্না দিতে চাইলে কয় টাকা নষ্ট করিস না,mɔʃenʃɔn e͡ɪ̯dɐ o͡ɪ̯dɐ kɪnnɐ d̪ɪt̪e cɐ͡ɪ̯le kɔe̯ tɐkɐ nɔʃto koɾɪʃ nɐ,eita oita kin̪e d̪it̪e t͡ɕail̪e bɔl̪e taka n̪ɔʂtɔ kɔris̪ɔ n̪a
আমার আম্মু আসছে আমাদের বাসায় ৬ মাস পরে, ময়মনসিংহঃ আমার আম্মা আইসে আমরার বাসায় ৬ মাস পরে,mɪmɪng ɐmɐɾ ɐmmɐ ɐ͡ɪ̯ʃe ɐmɾɐɾ bɐʃɐe̯ bo mɐʃ pɔɾe,amarɔ ammu as̪t͡ɕʰe amad̪erɔ bas̪ae̯ɔ ৬ mas̪ɔ pɔre
আম্মুর সামনে উনারা যা তা ঝগড়া করেন, ময়মনসিংহঃ আম্মার সামনে হেরা যা তা ঝগড়া করেন,mɔʲensɪn ɐmmɐɾ ʃɐmne heɾɐ ɟɐ t̪ɐ ɟʱɔgɽɐ kɔɾen,ammurɔ s̪amn̪e un̪ara d͡za t̪a d͡ʑ̤ɔɡɔɽa kɔren̪
ভালো ব্যবহার করেন না, ময়মনসিংহঃ ভালা ব্যবহার করেন না,menʃɪn bʱɐlɐ bɛbohɐɾ kɔɾen nɐ,b̤al̪o bd͡zɔbɔharɔ kɔren̪ɔ n̪a
একসাথে বসে খায় ও না, ময়মনসিংহঃ একলগে বয়া খায় ও না,mɔʲenʃɪg ɛklgk bɔʲɐ kʰɐe̯ o nɐ,eks̪at̪ʰe bɔs̪e kʰae̯ɔ o n̪a
আম্মু এসব দেখে খুব কষ্ট পাচ্ছেন যেহেতু আমার বাবা নেই, ময়মনসিংহঃ আম্মা এসব দেইক্ষা মেলা কষ্ট পাইসেন যেহেতু আমার আব্বা নাই,mɪmɪng ɐmmɐ eʃɔb d̪e͡ɪ̯kkʰɐ mɛlɐ koʃto pɐ͡ɪ̯sen ɟehet̪u ɐmɐɾ ɐbbɐ nɐ͡ɪ̯,ammu es̪ɔbɔ d̪ekʰe kʰubɔ kɔʂtɔ pat͡ɕt͡ɕʰen̪ɔ d͡zehet̪u amarɔ baba n̪ei
আমার স্বামী এসব নিয়ে কিছু বলতে গেলে উনি মনে করেন বউ ছেলের হয়ে গেছে, ময়মনসিংহঃ আমার জামাই এসব নিয়া কিসু কইতে গেলে হেয় মনে করেন বউ পোলার হয়া গেসে,mɔʲenʃɔn ɐmɐɾ ɟɐmɐ͡ɪ̯ eʃɔb nɪʲɐ kɪʃu ko͡ɪ̯t̪e gele hee̯ mone kɔɾen bɔ͡u̯ polɐɾ hɔʲɐ gese,amarɔ s̪bami es̪ɔbɔ n̪ie̯e kit͡ɕʰu bɔl̪ɔt̪e ɡel̪e un̪i mɔn̪e kɔren̪ɔ bu t͡ɕʰel̪erɔ he̯e ɡet͡ɕʰe
উনার আরো একটা ছেলে আছে, ময়মনসিংহঃ হের আরো একটা পোলা আসে, menʃɪn heɾ ɐɾo ɛktɐ polɐ ɐʃe,un̪arɔ aro ekta t͡ɕʰel̪e at͡ɕʰe
সে চাকরি করে বিয়ে বিয়ে করে নাই, ময়মনসিংহঃ হেয় চাকরি করে বিয়া বিয়া করে নাই,menoʃɪn hee̯ cɐkɾɪ koɾe bɪʲɐ bɪʲɐ koɾe nɐ͡ɪ̯,s̪e t͡ɕakri kɔre bie̯e bie̯e kɔre n̪ai
মার কাছে ছোটো ছেলেই সব, ময়মনসিংহঃ মার কাসে ছোটো পোলাই সব,menʃɪn mɐɾ kɐʃe cʰoto polɐ͡ɪ̯ ʃɔb,marɔ kat͡ɕʰe t͡ɕʰoto t͡ɕʰel̪ei s̪ɔbɔ
তার ছোটো ছেলের কোন দোষ নেই, ময়মনসিংহঃ হের ছোটো পোলার কোন দোষ নাই,mɔʲenʃɪn heɾ cʰoto polɐɾ kon d̪oʃ nɐ͡ɪ̯,t̪arɔ t͡ɕʰoto t͡ɕʰel̪erɔ kon̪ɔ d̪oʂɔ n̪ei
