bangla_speech,regional,regional_ipa,bangla_speech_ipa
আমি জানি তুমি চিঠিটা এখনি পড়তে শুরু করবে, ময়মনসিংহঃ আমি জানি তুমি চিঠিডা এহনি পড়তে শুরু করবা,mɔʲɪns ɐmɪ ɟɐnɪ t̪umɪ cɪtʰɪdɐ ehonɪ poɽt̪e ʃuɾu koɾbɐ,ami d͡ʑan̪i t̪umi t͡ɕitʰita ekʰn̪i pɔɽɔt̪e ɕuru kɔrɔbe
আম দিয়ে বানিয়ে ফেলতে পারেন শরবত, ময়মনসিংহঃ আম দিয়া বানায়া ফেলতে ফারেন শরবত,mɔʲensɪn ɐm d̪ɪʲɐ bɐnɐʲɐ pʰelt̪e pʰɐɾen ʃɔɾbot̪,amɔ d̪ie̯e ban̪ie̯e ɸel̪t̪e paren̪ɔ ɕɔrɔbɔt̪ɔ
আজকে স্কুলে তোমাদের কি কি পড়িয়েছে? , ময়মনসিংহঃ আইজকে ইস্কুলে তোমরারে কিতা কিতা পড়াইসে? ,mɔnoʃɪn ɐ͡ɪ̯ɟke ɪskule t̪omɾɐɾe kɪt̪ɐ kɪt̪ɐ pɔɽɐ͡ɪ̯ʃe? ,ad͡ʑke s̪kul̪e t̪omad̪erɔ ki ki pɔɽie̯et͡ɕʰe? 
আমার আগের কোনো কথা কিছুই মনে নেই , ময়মনসিংহঃ আমার আগের কোন কথা কিনুতাই মনে নাই ,menʃɪn ɐmɐɾ ɐgeɾ kon kɔt̪ʰɐ kɪnut̪ɐ͡ɪ̯ mone nɐ͡ɪ̯ ,amarɔ aɡerɔ kon̪o kɔt̪ʰa kit͡ɕʰui mɔn̪e n̪ei 
তুমি এত অমনোযোগী হলে পরিক্ষায় ভালো ফলাফল করবে না , ময়মনসিংহঃ তুমি এত অমনোযোগী হইলে পরিক্ষায় ভাল ফলাফল করতা না ,menʃɪn t̪umɪ ɛt̪o ɔmonoɟogɪ ho͡ɪ̯le poɾɪkkʰɐe̯ bʱɐlo pʰɔlɐpʰɔl koɾt̪ɐ nɐ ,t̪umi et̪ɔ omn̪od͡zoɡi hɔl̪e pɔrikʂae̯ɔ b̤al̪o ɸɔl̪aɸɔl̪ɔ kɔrɔbe n̪a 
এই বিষয়ে কি করতে পারি আমি? , ময়মনসিংহঃ এই বিষয়ে কিতা করতে পারি আমি? ,menʃɪn e͡ɪ̯ bɪʃɔʲe kɪt̪ɐ koɾt̪e pɐɾɪ ɐmɪ? ,ei biʂe̯e ki kɔrɔt̪e pari ami? 
হায়রে মানুষ একজন আরেকজনের প্রতি হিংসা করে, ময়মনসিংহঃ হায়রে মানুষ একজন আরেকজনের প্রতি হিংসা করে,menʃɪn hɐʲɾe mɐnuʃ ɛkɟon ɐɾekɟɔneɾ pɾot̪ɪ hɪŋʃɐ koɾe,hae̯re man̪uʂɔ ekɔd͡ʑɔn̪ɔ arekɔd͡ʑɔn̪erɔ prɔt̪i hiŋs̪a kɔre
আমি আমার বাসার সামনের খেলার মাঠে খেলি , ময়মনসিংহঃ আমি আমার বাসার সামনের খেলার মাঠে খেলি ,mɔʲensɪn ɐmɪ ɐmɐɾ bɐʃɐɾ ʃɐmoneɾ kʰelɐɾ mɐtʰe kʰelɪ ,ami amarɔ bas̪arɔ s̪amn̪erɔ kʰel̪arɔ matʰe kʰel̪i 
আম দিয়ে শরবত বানিয়ে খাও , ময়মনসিংহঃ আম দিয়া শরবত বানায়া খাও ,mɔnoʃɪn ɐm d̪ɪʲɐ ʃɔɾbot̪ bɐnɐʲɐ kʰɐ͡o̯ ,amɔ d̪ie̯e ɕɔrɔbɔt̪ɔ ban̪ie̯e kʰao 
ঠাণ্ডা শরবত খেলে ভালো লাগবে তোমার , ময়মনসিংহঃ ঠাণ্ডা শরবত খাইলে ভালা লাগব তোমার ,mɔnoʃɔn tʰɐndɐ ʃɔɾbot̪ kʰɐ͡ɪ̯le bʱɐlɐ lɐgbo t̪omɐɾ ,tʰanda ɕɔrɔbɔt̪ɔ kʰel̪e b̤al̪o l̪aɡbe t̪omarɔ 
এতো চিন্তা করা লাগবে না নিজেরে নিয়ে ভাবো , ময়মনসিংহঃ এতো চিন্তা করা লাগব না নিজেরে নিয়া ভাবো ,menʃɪnh et̪o cɪnt̪ɐ kɔɾɐ lɐgbo nɐ nɪɟeɾe nɪʲɐ bʱɐbo ,et̪o t͡ɕin̪t̪a kɔra l̪aɡbe n̪a n̪id͡ʑere n̪ie̯e b̤abo 
আমকে আমাদের দেশে ‘ফলের রাজা’ বলা হয়, ময়মনসিংহঃ আমরে আমরার দেশে ‘ফলের রাজা’ কওয়ন হয়,mɔʲensɪn ɐmɾe ɐmɾɐɾ d̪eʃe 'ʱɔpʰɔleɾ ɾɐɟɐ' kɔ͡o̯ʲon hɔe̯,amke amad̪erɔ d̪eɕe ‘ɸɔl̪erɔ rad͡ʑa’ bɔl̪a he̯ɔ
তুমি দেখতে সুন্দর না হলেও আমি তোমাকেই চাই, ময়মনসিংহঃ তুমি দেখতে সুন্দর না হইলেও আমি তোমারেই চাই,mɔʲensɪng t̪umɪ d̪ekʰt̪e ʃund̪ɔɾ nɐ ho͡ɪ̯le͡o̯ ɐmɪ t̪omɐɾe͡ɪ̯ cɐ͡ɪ̯,t̪umi d̪ekʰt̪e s̪un̪d̪ɔrɔ n̪a hɔl̪eo ami t̪omakei t͡ɕai
সেখানে অনেক পুলিশ দেখে বাসার দিকে ফিরছিলাম, ময়মনসিংহঃ ওইহানে মেলা পুলিশ দেইক্ষা বাসার দিকে ফিরছিলাম,mɪnʃɪn o͡ɪ̯hɐne mɛlɐ pulɪʃ d̪e͡ɪ̯kkʰɐ bɐʃɐɾ d̪ɪke pʰɪɾcʰɪlɐm,s̪ekʰan̪e on̪ekɔ pul̪iɕɔ d̪ekʰe bas̪arɔ d̪ike ɸirt͡ɕʰil̪am
বুঝে উঠতে পারছিলাম না কী করবো, ময়মনসিংহঃ বুইজ্ঝা উঠতে পারতাসিলাম না কীতা করবাম , menʃɪn bu͡ɪ̯ɟɟʱɐ utʰt̪e pɐɾt̪ɐʃɪlɐm nɐ kɪt̪ɐ koɾbɐm ,bud͡ʑ̤e utʰt̪e part͡ɕʰil̪amɔ n̪a ki kɔrɔbo
তোমার সব কথা ঠিক আছে, ময়মনসিংহঃ তোমার বেক কথা ঠিক আছে,menʃɪn t̪omɐɾ bek kɔt̪ʰɐ tʰɪk ɐcʰe,t̪omarɔ s̪ɔbɔ kɔt̪ʰa tʰikɔ at͡ɕʰe
আমি ভালো ছেলে, ময়মনসিংহঃ আমি ভালা ছেলে,menoʃɔg ɐmɪ vɐlɐ cʰele,ami b̤al̪o t͡ɕʰel̪e
বিয়ের জন্য আব্বা আমার জন্য মেয়ে খুজতাসে, ময়মনসিংহঃ বিয়ার লাইগা আব্বা আমার লাইগা মেয়ে খুজতাসে, mɔʲɪng bɪʲɐɾ lɐ͡ɪ̯gɐ ɐbbɐ ɐmɐɾ lɐ͡ɪ̯gɐ meʲe kʰuɟt̪ɐʃe,bie̯erɔ d͡ʑɔn̪d͡zɔ abba amarɔ d͡ʑɔn̪d͡zɔ mee̯e kʰud͡ʑt̪as̪e
আম্মা আমাকে গতকাল একটা ছেলের সাথে দেখা করতে বলেছিলও, ময়মনসিংহঃ আম্মা আমারে গতকাল একটা ছেলের সাথে দেখা করতে কইসিল,mɪnʃɪn ɐmmɐ ɐmɐɾe gɔt̪okɐl ɛktɐ cʰeleɾ ʃɐt̪ʰe d̪ɛkʰɐ koɾt̪e ko͡ɪ̯sɪl,amma amake ɡɔt̪ɔkal̪ɔ ekta t͡ɕʰel̪erɔ s̪at̪ʰe d̪ekʰa kɔrɔt̪e bɔl̪et͡ɕʰil̪o
ছেলেটিকে আমার ভাল লেগেছে, ময়মনসিংহঃ ছেড়াটারে আমার ভাল লাগছে,mɔnoʃɪng cʰeɽɐtɐɾe ɐmɐɾ bʱɐlo lɐgcʰe,t͡ɕʰel̪etike amarɔ b̤al̪ɔ l̪eɡet͡ɕʰe
ছেলেটি হয়ত অন্য কোনও মেয়েকে ভালবাসে, ময়মনসিংহঃ ছেড়াটা হয়তো অন্য কোনও ছেড়িরে ভালবাসে,mɔʲenʃɪng cʰeɽɐtɐ hɔʲt̪o ɔnno kono cʰeɽɪɾe bʱɐlbɐʃe,t͡ɕʰel̪eti he̯ɔt̪ɔ on̪d͡zɔ kon̪o mee̯eke b̤al̪bas̪e
মেয়েটি ছেলেটার অপেক্ষায় থাকে, ময়মনসিংহঃ ছেড়িটা ছেড়াটার অপেক্ষায় থাকে,menoʃɪng cʰeɽɪtɐ cʰeɽɐtɐɾ ɔpekkʰɐe̯ t̪ʰɐke,mee̯eti t͡ɕʰel̪etarɔ opekʂae̯ɔ t̪ʰake
ছেলেটি কেন যে মেয়েটার মনের কথা বুঝে না, ময়মনসিংহঃ ছেড়াটা কিল্লেগা যে ছেড়িটার মনের কথা বুঝেনা,mɔnoʃɪnh cʰeɽɐtɐ kɪllegɐ ɟe cʰeɽɪtɐɾ moneɾ kɔt̪ʰɐ buɟʱenɐ,t͡ɕʰel̪eti ken̪ɔ d͡ze mee̯etarɔ mɔn̪erɔ kɔt̪ʰa bud͡ʑ̤e n̪a
মেয়েটি হয়ত ছেলেটাকে তাঁর মনের কথা ভাল ভাবে বুঝাতে পারেনাই, ময়মনসিংহঃ ছেড়িটা হয়তো ছেড়াটারে তার মনের কথা ভালাভাবে বুঝাইতে পারে নাই,mɔʲensɪng cʰeɽɪtɐ hɔʲt̪o cʰeɽɐtɐɾe t̪ɐɾ moneɾ kɔt̪ʰɐ bʱɐlɐbʱɐbe buɟʱɐ͡ɪ̯t̪e pɐɾe nɐ͡ɪ̯,mee̯eti he̯ɔt̪ɔ t͡ɕʰel̪etake t̪ɔ̃rɔ mɔn̪erɔ kɔt̪ʰa b̤al̪ɔ b̤abe bud͡ʑ̤at̪e paren̪ai
হয়ত কোন একদিন ছেলেটি মেয়েটাকে ভালবাসবে, ময়মনসিংহঃ হয়তো কোন একদিন ছেড়াটা ছেড়িটারে ভালবাসবো,mɔʲt̪o kon ɛkd̪ɪn cʰeɽɐtɐ cʰeɽɪtɐɾe bʱɐlbɐʃbo,he̯ɔt̪ɔ kon̪ɔ ekd̪in̪ɔ t͡ɕʰel̪eti mee̯etake b̤al̪bas̪ɔbe
তুমি আমাকে দয়া করে আর বিরক্ত করো না, ময়মনসিংহঃ তুমি আমারে দয়া কইরা আর বিরক্ত কইরোনা,mɔʲenʃɔn t̪umɪ ɐmɐɾe d̪ɔʲɐ ko͡ɪ̯ɾɐ ɐɾ bɪɾokt̪o ko͡ɪ̯ɾonɐ,t̪umi amake d̪e̯a kɔre arɔ birɔkt̪ɔ kɔro n̪a
সে তাকে অনেক বিরক্ত করে, ময়মনসিংহঃ সে তারে অনেক বিরক্ত করে,menʃɪn ʃe t̪ɐɾe ɔnek bɪɾokt̪o koɾe,s̪e t̪ake on̪ekɔ birɔkt̪ɔ kɔre
তাকে নিয়ে আমি আমার গ্রামের বাড়িতে ঘুরতে যেতে চাই, ময়মনসিংহঃ তারে নিয়া আমি আমার গ্রামের বাড়ি ঘুরতে যাইতে চাই,mɪnʃɪn t̪ɐɾe nɪʲɐ ɐmɪ ɐmɐɾ gɾɐmeɾ bɐɽɪ gʱuɾt̪e ɟɐ͡ɪ̯t̪e cɐ͡ɪ̯,t̪ake n̪ie̯e ami amarɔ ɡɔramerɔ baɽit̪e ̤ɡ̤urt̪e d͡zet̪e t͡ɕai
এইবার ছুটিতে সিলেট ঘুরতে যাব, ময়মনসিংহঃ এইবার ছুটিতে সিলেট ঘুরতে যামু,menʃɪn e͡ɪ̯bɐɾ cʰutɪt̪e sɪlet gʱuɾt̪e ɟɐmu,eibarɔ t͡ɕʰutit̪e s̪il̪etɔ ̤ɡ̤urt̪e d͡zab
আমি যাকে ভালবাসি সে সিলেটে থাকে, ময়মনসিংহঃ আমি যারে ভালবাসি সে সিলেটে থাকে,menʃɪn ɐmɪ ɟɐɾe bʱɐlbɐʃɪ ʃe sɪlete t̪ʰɐke,ami d͡zake b̤al̪bas̪i s̪e s̪il̪ete t̪ʰake
আমার এখন বইটা লাগবে নাহ, ময়মনসিংহঃ আমার এহন বইডা লাগতোনা,menʃɪn ɐmɐɾ ehon bo͡ɪ̯dɐ lɐgt̪onɐ,amarɔ ekʰɔn̪ɔ bita l̪aɡbe n̪ahɔ
তুমি কি এই বইটি পড়তে চাও ?, ময়মনসিংহঃ তুমি কি এই বইডা পড়তে চাও?,mɔʲenʃɪn t̪umɪ kɪ e͡ɪ̯ bo͡ɪ̯dɐ poɽt̪e cɐ͡o̯?,t̪umi ki ei biti pɔɽɔt̪e t͡ɕao ?
সে কি এই বইটি পড়তে চায় ?, ময়মনসিংহঃ সে কি এই বইডা পড়তে চায়?,mɔʲenʃɪn ʃe kɪ e͡ɪ̯ bo͡ɪ̯dɐ poɽt̪e cɐe̯?,s̪e ki ei biti pɔɽɔt̪e t͡ɕae̯ɔ ?
আপনি কি এই বইটি পড়তে চান ?, ময়মনসিংহঃ আফনে এই বইডা পড়তে চান ?,menʃɪn ɐcʰone e͡ɪ̯ bo͡ɪ̯dɐ poɽt̪e cɐn?,apn̪i ki ei biti pɔɽɔt̪e t͡ɕan̪ɔ ?
আমার বই পরতে অনেক ভাল লাগে, ময়মনসিংহঃ আমার বই পড়তে মেলা ভালালাগে,mɔnoʃɔn ɐmɐɾ bo͡ɪ̯ poɽt̪e mɛlɐ bʱɐlɐlɐge,amarɔ bi pɔrɔt̪e on̪ekɔ b̤al̪ɔ l̪aɡe
তোমার আমাকে চিনতে হবে না  , ময়মনসিংহঃ তোমারে আমার চিনতে হইবোনা,mɔʲensɪn t̪omɐɾe ɐmɐɾ cɪnt̪e ho͡ɪ̯bonɐ,t̪omarɔ amake t͡ɕin̪t̪e hɔbe n̪a  
অনেক রাত হয়েছে এখন ঘুমিয়ে যাও , ময়মনসিংহঃ মেলা রাইত হইসে এহন ঘুমায়া যাও,mɔʲenʃɪn mɛlɐ ɾɐ͡ɪ̯t̪o ho͡ɪ̯ʃe ehon gʱumɐʲɐ ɟɐ͡o̯,on̪ekɔ rat̪ɔ he̯et͡ɕʰe ekʰɔn̪ɔ ̤ɡ̤umie̯e d͡zao 
তোমাকে পড়ালেখা করতে হবে, ময়মনসিংহঃ তোমার পড়ালেহা করতে হইব,mɔʲensɪng t̪omɐɾ pɔɽɐlehɐ koɾt̪e ho͡ɪ̯bo,t̪omake pɔɽal̪ekʰa kɔrɔt̪e hɔbe
তোমার পড়ালেখা করতে ভাল লাগে না?, ময়মনসিংহঃ তোমার পড়ালেহা করতে ভালালাগেনা?,menos t̪omɐɾ pɔɽɐlehɐ koɾt̪e bʱɐlɐlɐgenɐ?,t̪omarɔ pɔɽal̪ekʰa kɔrɔt̪e b̤al̪ɔ l̪aɡe n̪a?
আমাকে পড়ালেখা করতে হবে, ময়মনসিংহঃ আমার পড়ালেহা করতে হইব,menʃɪn ɐmɐɾ pɔɽɐlehɐ koɾt̪e ho͡ɪ̯bo,amake pɔɽal̪ekʰa kɔrɔt̪e hɔbe
সে অনেক ভালো রান্না করে, ময়মনসিংহঃ হেয় অনেক ভালা রানদে,mɔnoʃɪng hee̯ ɔnek bʱɐlɐ ɾɐnd̪e,s̪e on̪ekɔ b̤al̪o ran̪n̪a kɔre
আমি একটি বিদ্যালয় পড়ালেখা করি , ময়মনসিংহঃ আমি একটা ইস্কুলে পড়ালেহা করি,menʃɪn ɐmɪ ɛktɐ ɪskule pɔɽɐlehɐ koɾɪ,ami ekti bid̪d͡zal̪e̯ɔ pɔɽal̪ekʰa kɔri 
আমার ছোট বোন একটি বিদ্যালয়ে পড়ে, ময়মনসিংহঃ আমার ছোট বইন একটা ইস্কুলে পড়ে,menʃɪn ɐmɐɾ cʰoto bo͡ɪ̯n ɛktɐ ɪskule pɔɽe,amarɔ t͡ɕʰotɔ bon̪ɔ ekti bid̪d͡zal̪e̯e pɔɽe
আমার ছোট ভাই একটি বিদ্যালয়ে পড়ালেখা করে, ময়মনসিংহঃ আমার ছোট ভাই একটা ইস্কুলে পড়ালেহা করে,menʃɪn ɐmɐɾ cʰoto bʱɐ͡ɪ̯ ɛktɐ ɪskule pɔɽɐlehɐ koɾe,amarɔ t͡ɕʰotɔ b̤ai ekti bid̪d͡zal̪e̯e pɔɽal̪ekʰa kɔre
আমার বিদ্যালয়ে যেতে ভাল লাগে না, ময়মনসিংহঃ আমার ইস্কুলে যাইতে ভালা লাগেনা,menʃɪn ɐmɐɾ ɪskule ɟɐ͡ɪ̯t̪e bʱɐlɐ lɐgenɐ,amarɔ bid̪d͡zal̪e̯e d͡zet̪e b̤al̪ɔ l̪aɡe n̪a
আমার বিয়ের বয়স পার হয়ে যাচ্ছে, ময়মনসিংহঃ আমার বিয়ার বয়স পার হয়া যাইতাসেগা,mɔʲensɪn ɐmɐɾ bɪʲɐɾ bɔʲoʃ pɐɾ hɔʲɐ ɟɐ͡ɪ̯t̪ɐʃegɐ,amarɔ bie̯erɔ be̯ɔs̪ɔ parɔ he̯e d͡zat͡ɕt͡ɕʰe
আহারে তোমার মনে কতো দুঃখ, ময়মনসিংহঃ আহার তুমার মনে কত দুঃখ,mɔʲensɪn ɐhɐɾ t̪umɐɾ mone kɔt̪o d̪ukkʰo,ahare t̪omarɔ mɔn̪e kɔt̪o d̪uঃkʰɔ
আমি ঘুমাতে যাবো, ময়মনসিংহঃ আমি ঘুমাইতে যায়াম,menʃɔn ɐmɪ gʱumɐ͡ɪ̯t̪e ɟɐʲɐm,ami ̤ɡ̤umat̪e d͡zabo
আমি নাচতে পারি, ময়মনসিংহঃ আমি নাচতাম পারি,menʃɔn ɐmɪ nɐct̪ɐm pɐɾɪ,ami n̪at͡ɕt̪e pari
আমি সাঁতার কাটতে পছন্দ করি , ময়মনসিংহঃ আমি হাতার কাটতাম পছন্দ করি,menʃɪn ɐmɪ hɐt̪ɐɾ kɐtt̪ɐm pɔcʰond̪o koɾɪ,ami s̪ɔ̃t̪arɔ katt̪e pɔt͡ɕʰɔn̪d̪ɔ kɔri 
আমি তোমার বাসায় ঘুরতে আসবো, ময়মনসিংহঃ আমি তোমার বাসায় ঘুরতে আয়াম,menʃɪn ɐmɪ t̪omɐɾ bɐʃɐe̯ gʱuɾt̪e ɐʲɐm,ami t̪omarɔ bas̪ae̯ɔ ̤ɡ̤urt̪e as̪bo
সে তার গ্রামের বাড়িতে ঘুরতে গিয়েছে, ময়মনসিংহঃ হেয় হের গেরামের বারিত ঘুরতে গেসে,mɔʲensɪng hee̯ heɾ geɾɐmeɾ bɐɾɪt̪ɔ gʱuɾt̪e gese,s̪e t̪arɔ ɡɔramerɔ baɽit̪e ̤ɡ̤urt̪e ɡie̯et͡ɕʰe
আমার বন্ধু মানসিক ভাবে দুর্বল, ময়মনসিংহঃ আমার বন্ধু মানসিক ভাবে দুর্বল,mɔnoʃɪn ɐmɐɾ bond̪ʱu mɐnoʃɪk bʱɐbe d̪uɾbol,amarɔ bɔn̪d̪̤u man̪s̪ikɔ b̤abe d̪urbɔl̪ɔ
এমন অবস্থায় তার কি করা উচিত ?, ময়মনসিংহঃ এমন অবস্থাতে হের কিতা করন উচিত?,menʃɪng ɛmon ɔbost̪ʰɐt̪e heɾ kɪt̪ɐ kɔɾon ucɪt̪?,emɔn̪ɔ obɔs̪t̪ʰae̯ɔ t̪arɔ ki kɔra ut͡ɕit̪ɔ ?
আমার দুইটি বাবু আছে, ময়মনসিংহঃ আমার দুইটা আবু আসে,mɔʲensɪn ɐmɐɾ d̪u͡ɪ̯tɐ ɐbu ɐʃe,amarɔ d̪uiti babu at͡ɕʰe
আমার স্বামীকে আমি খুব ভালোবাসি, ময়মনসিংহঃ আমার জামাইরে আমি মেলা ভালবাসি,mɔnosɪng ɐmɐɾ ɟɐmɐ͡ɪ̯ɾe ɐmɪ mɛlɐ bʱɐlbɐʃɪ,amarɔ s̪bamike ami kʰubɔ b̤al̪obas̪i
অনেক দিন পর আপনার সাথে দেখা, ময়মনসিংহঃ মেলাদিন পরে আফনের সাথে দেহা,mɔʲenʃɪn pɔɾe ɐpʰoneɾ ʃɐt̪ʰe d̪ehɐ,on̪ekɔ d̪in̪ɔ pɔrɔ apn̪arɔ s̪at̪ʰe d̪ekʰa
আপনি কেমন আছেন ?, ময়মনসিংহঃ আফনে কেমন আসেন,menʃɪn ɐcʰone kɛmon ɐʃen,apn̪i kemɔn̪ɔ at͡ɕʰen̪ɔ ?
আপনার কি আমার কথা মনে আছে এখনও ?, ময়মনসিংহঃ আফনের কি আমার কথা মনে আসে এহনও?,mɔʲenʃɔn ɐpʰoneɾ kɪ ɐmɐɾ kɔt̪ʰɐ mone ɐʃe ehono?,apn̪arɔ ki amarɔ kɔt̪ʰa mɔn̪e at͡ɕʰe ekʰn̪o ?
আমার পড়ালেখা করতে ভালো লাগে নাহ, ময়মনসিংহঃ আমার পড়ালেহা করতে ভালা লাগে নাহ,menoʃɔg ɐmɐɾ pɔɽɐlehɐ koɾt̪e bʱɐlɐ lɐge nɐh,amarɔ pɔɽal̪ekʰa kɔrɔt̪e b̤al̪o l̪aɡe n̪ahɔ
আমার বিদেশে গিয়ে পড়ালেখা করার স্বপ্ন, ময়মনসিংহঃ আমার বিদেশে যায়া পড়ালেহা করার স্বপ্ন,mɔnoʃɪn ɐmɐɾ bɪd̪eʃe ɟɐʲɐ pɔɽɐlehɐ kɔɾɐɾ ʃɔpno,amarɔ bid̪eɕe ɡie̯e pɔɽal̪ekʰa kɔrarɔ s̪bɔpn̪ɔ
আপনার সাথে কথা বলে অনেক ভালো লাগলো, ময়মনসিংহঃ আফনের লগে কথা কয়া মেলা ভালা লাগলো,menʃɪn ɐpʰoneɾ lɔge kɔt̪ʰɐ kɔʲɐ mɛlɐ bʱɐlɐ lɐglo,apn̪arɔ s̪at̪ʰe kɔt̪ʰa bɔl̪e on̪ekɔ b̤al̪o l̪aɡl̪o
অনেকে বলে প্রেম করলে মানুষ বোকা হয়, ময়মনসিংহঃ অনেকে কয় প্রেম করলে মাইনষে বেক্কল হয়,mɔʃenʃe ɔneke kɔe̯ pɾem koɾle mɐ͡ɪ̯nʃe bekkol hɔe̯,on̪eke bɔl̪e premɔ kɔrɔl̪e man̪uʂɔ boka he̯ɔ
অনেকে আরো বলে যে বিয়ে করলে মানুষ নাকি গাধা হয়, ময়মনসিংহঃ অনেকে আরো কয় যে বিয়া করলে মাইনষে নাকি গাধা হয়,mɔʃenʃe ɐɾo kɔe̯ ɟe bɪʲɐ koɾle mɐ͡ɪ̯nʃe nɐkɪ gɐd̪ʱɐ hɔe̯,on̪eke aro bɔl̪e d͡ze bie̯e kɔrɔl̪e man̪uʂɔ n̪aki ɡad̪̤a he̯ɔ
একজন লোক মারা গেছেন, ময়মনসিংহঃ একজন বেডা মারা গেসেন,mɔʲenʃɔn ɛkɟon bedɐ mɐɾɐ gesen,ekɔd͡ʑɔn̪ɔ l̪okɔ mara ɡet͡ɕʰen̪
তুমি এত গরীব আগে কেন বলোনি, ময়মনসিংহঃ তুমি এত গরিব আগে কেন কও নাই,mɔʲenʃɪn t̪umɪ ɛt̪o goɾɪb ɐge keno kɔ͡o̯ nɐ͡ɪ̯,t̪umi et̪ɔ ɡɔribɔ aɡe ken̪ɔ bɔl̪on̪i
আমি আগেই বলেছি তুমি ছাড়া এই পৃথিবীতে আমার আর কিছুই নাই, ময়মনসিংহঃ আমি আগেও কইসি তুমি ছাড়া এই দুনিয়াতে আমার আর কিসুই নাই,mɔʲenʃɪn ɐmɪ ɐge͡o̯ ko͡ɪ̯ʃɪ t̪umɪ cʰɐɽɐ e͡ɪ̯ d̪unɪʲɐt̪e ɐmɐɾ ɐɾ kɪʃu͡ɪ̯ nɐ͡ɪ̯,ami aɡei bɔl̪et͡ɕʰi t̪umi t͡ɕʰaɽa ei pɽit̪ʰibit̪e amarɔ arɔ kit͡ɕʰui n̪ai
মনের ভালোবাসা চিরদিন থেকে যাবে, ময়মনসিংহঃ মনের ভালোবাসা চিরদিন থাইক্কা যাইব,menʃɪn moneɾ bʱɐlobɐʃɐ cɪɾod̪ɪn t̪ʰɐ͡ɪ̯kkɐ ɟɐ͡ɪ̯bo,mɔn̪erɔ b̤al̪obas̪a t͡ɕird̪in̪ɔ t̪ʰeke d͡zabe
জীবনের কিছুটা পথ একা একা চলা তেমন কঠিন নয়, ময়মনসিংহঃ জীবনের কিসুটা পথ একলা চলা তেমন কঠিন না,mɔʃɔneɾ kɪʃutɐ pɔt̪ʰ ɛklɐ cɔlɐ t̪ɛmon kotʰɪn nɐ,d͡ʑibn̪erɔ kit͡ɕʰuta pɔt̪ʰɔ eka eka t͡ɕɔl̪a t̪emɔn̪ɔ kɔtʰin̪ɔ n̪e̯ɔ
জীবন হলো বাঁচার জন্য, ময়মনসিংহঃ জীবন হইলো বাঁচার লাইজ্ঞা,menʃɪn ɟɪbɔn ho͡ɪ̯lo bɐ̃cɐɾ lɐ͡ɪ̯ggɐ,d͡ʑibɔn̪ɔ hɔl̪o bɔ̃t͡ɕarɔ d͡ʑɔn̪d͡zɔ
মন হলো দেবার জন্য, ময়মনসিংহঃ মন হইলো দেয়ার লাইজ্ঞা,menʃɪn mon ho͡ɪ̯lo d̪eʲɐɾ lɐ͡ɪ̯ggɐ,mɔn̪ɔ hɔl̪o d̪ebarɔ d͡ʑɔn̪d͡zɔ
ভালবাসা হলো সারা জীবন পাশে থাকার জন্য, ময়মনসিংহঃ ভালবাসা হইলো সারাজীবন পাশে থাকার লাইজ্ঞা,mɔʲenʃɔn bʱɐlbɐʃɐ ho͡ɪ̯lo ʃɐɾɐɟɪbɔn pɐʃe t̪ʰɐkɐɾ lɐ͡ɪ̯ggɐ,b̤al̪bas̪a hɔl̪o s̪ara d͡ʑibɔn̪ɔ paɕe t̪ʰakarɔ d͡ʑɔn̪d͡zɔ
আমি কিছু ভাবতে পারিনা তোমায় ছাড়া, ময়মনসিংহঃ আমি কিসু ভাবতে ফারিনা তোমারে ছাড়া,menʃɪn ɐmɪ kɪʃu bʱɐbt̪e pʰɐɾɪnɐ t̪omɐɾe cʰɐɽɐ,ami kit͡ɕʰu b̤abt̪e parin̪a t̪omae̯ɔ t͡ɕʰaɽa
আমি কিছু লিখতে পারিনা তোমার নাম ছাড়া, ময়মনসিংহঃ আমি কিসু লিখতাম ফারিনা তোমার নাম ছাড়া,mɔnoʃɔn ɐmɪ kɪʃu lɪkʰt̪ɐm pʰɐɾɪnɐ t̪omɐɾ nɐm cʰɐɽɐ,ami kit͡ɕʰu l̪ikʰt̪e parin̪a t̪omarɔ n̪amɔ t͡ɕʰaɽa
আমি কিছু বুঝতে চাইনা তোমায় ছাড়া , ময়মনসিংহঃ আমি কিসু বুঝতাম চাই না তোমারে ছাড়া,mɔʲensɪn ɐmɪ kɪʃu buɟʱt̪ɐm cɐ͡ɪ̯ nɐ t̪omɐɾe cʰɐɽɐ,ami kit͡ɕʰu bud͡ʑ̤t̪e t͡ɕain̪a t̪omae̯ɔ t͡ɕʰaɽa 
ভালবাসায় এমন কেন হয়?, ময়মনসিংহঃ ভালবাসায় এমন কেরে হয়?,menʃɪnh bʱɐlbɐʃɐe̯ ɛmon keɾe hɔe̯?,b̤al̪bas̪ae̯ɔ emɔn̪ɔ ken̪ɔ he̯ɔ?
যখন ছেলে বুঝে তখন মেয়ে বুঝেনা , ময়মনসিংহঃ যখন ছেড়া বুঝে তখন ছেড়ি বুঝেনা !,mɔnoʃɪn ɟɔkʰon cʰeɽɐ buɟʱe t̪ɔkʰon cʰeɽɪ buɟʱenɐ!,d͡zɔkʰɔn̪ɔ t͡ɕʰel̪e bud͡ʑ̤e t̪ɔkʰɔn̪ɔ mee̯e bud͡ʑ̤en̪a 
ভালোবাসি তোমাকে বলা বাকি, ময়মনসিংহঃ ভালবাসি তোমারে কওয়া বাকি,menʃɔn bʱɐlbɐʃɪ t̪omɐɾe koʷɐ bɐkɪ,b̤al̪obas̪i t̪omake bɔl̪a baki
আমার খুব গরম লাগছে, ময়মনসিংহঃ আমার মেলা গরম লাগতাসে,mɔʲenʃɔg ɐmɐɾ mɛlɐ gɔɾom lɐgt̪ɐʃe,amarɔ kʰubɔ ɡɔrɔmɔ l̪aɡt͡ɕʰe
তোমার কি গরম লাগছে ?, ময়মনসিংহঃ তোমার কিতা গরম লাগতাসে?,mɔʲenʃɔn t̪omɐɾ kɪt̪ɐ gɔɾom lɐgt̪ɐʃe?,t̪omarɔ ki ɡɔrɔmɔ l̪aɡt͡ɕʰe ?
আপনার কি গরম লাগছে?, ময়মনসিংহঃ আফনের কি গরম লাগতাসে?,menʃɪn ɐpʰoneɾ kɪ gɔɾom lɐgt̪ɐʃe?,apn̪arɔ ki ɡɔrɔmɔ l̪aɡt͡ɕʰe?
আপনি কি আমাকে ভালবাসেন?, ময়মনসিংহঃ আফনে কি আমারে ভালবাসেন?,menʃɪn ɐcʰone kɪ ɐmɐɾe bʱɐlbɐsen?,apn̪i ki amake b̤al̪bas̪en̪ɔ?
